Incident,Date,Incident Type,Address,Updated
"Firefighters Called To Smoke-Filled Downtown Apartment","02/21/2017","Cooking","400 Block W. Wilson Street, Madison, WI 53703",""
"Fire Consumes Vehicle On Walnut Street","02/20/2017","Vehicle","500 Block Walnut Street, Madison, WI 53703",""
"Structure Fire On Sherman Terrace","02/19/2017","Structure","Sherman Terrace, Madison, WI 53703","Updated: 02/20/2017"
"Burned Steaks To Blame For Downtown Smoke Scare","02/18/2017","Cooking","300 Block W. Johnson St, Madison, WI",""
"Unattended Pan Of Oil Leads To Small Kitchen Fire","02/16/2017","Cooking","Flower Lane, Madison, WI 53717",""
"Crews Extricate Driver From Tipped Vehicle","02/14/2017","Vehicle","Winnebago St. & First St, Madison, WI 53703",""
"Small Fire In Back Of Pickup Truck Traced To Discarded Cigarette","02/14/2017","Assist Citizen","E. Dayton Street & N. Few Street, Madison, WI 53703",""
"Two-Vehicle Crash On Femrite Drive Injures One","02/11/2017","Vehicle","Femrite Drive & I90 Eastbound, Madison, WI",""
"Vehicle Leaking Gasoline Towed From Downtown Ramp","02/10/2017","Vehicle","300 Block W. Mifflin Street, Madison, WI 53703",""
"Toxic Chemical Combo Sends One To Hospital","02/10/2017","Hazmat","300 Block Samuel Drive, Madison, WI 53703",""
"One Transported To Hospital With Thumb Lodged In Bathroom Sink","02/10/2017","Assist Citizen","Sherman Terrace, Madison, WI 53703",""
"Overloaded Wash Machine Causes Water Spill","02/09/2017","Water Leak","Gerry Court, Madison, WI 53703",""
"Man Suffers Serious Injuries After Falling Into 6-Foot Pit","02/08/2017","EMS","2700 Block S. Stoughton Road, Madison, WI",""
"Man Uninjured After Car Ahead Of Him Knocks Down Light Pole","02/08/2017","Vehicle","Verona Road / Atticus Way, Madison, WI",""
"Black Lab Accidentally Turns On Stovetop Burners; Dog And Owner OK","02/07/2017","Structure","Buckeye Road area, Madison, WI 53705",""
"Garbage Truck Contents Catch On Fire","02/07/2017","Trash/Rubbish","N. Biltmore Ln. / Eastpark Blvd, Madison, WI",""
"Plow Truck Sustains Damage Following Small Fire","02/07/2017","Vehicle","1000 Block Short Street, Madison, WI",""
"Food Left On Active Stovetop Prompts Fire Department Response","02/07/2017","Cooking","200 Block S. Park Street, Madison, WI",""
"Crash Involving Electrical Box Live, Driver Ordered to Stay in Vehicle","02/03/2017","Vehicle","N. Butler St and E. Washington Ave, Madison, WI",""
"Smoke Odor At Grocery Store Traced To Light Ballast","02/02/2017","Electrical","600 Block S. Whitney Way, Madison, WI",""
"Suspicious Vehicle Fire Under Investigation","02/02/2017","Vehicle","2400 Block S. Park Street, Madison, WI",""
"Gallons of Gasoline Spill At Northside Gas Station","02/01/2017","Fuel Spill","2300 Block Commercial Ave, Madison, WI 53703",""
"Paramedics Help Man Get Back On His Feet, Then Shovel His Driveway","01/31/2017","Assist Citizen","Cameo Lane, Madison, WI 53703",""
"Three Transported From Stoughton Road Crash","01/30/2017","Vehicle","S. Stoughton Road / Pflaum Road, Madison, WI",""
"Box Of Tissues Catches Fire In East Side Apartment","01/30/2017","Trash/Rubbish","30 Block N. Sherman Terrace, Madison, WI",""
"Discarded Ashes Ignite Trash Can Fire","01/30/2017","Trash/Rubbish","4100 Block Hillcrest Drive, Madison, WI 53703",""
"Burning Smell Traced To Dishwasher In West Side Home","01/29/2017","Smoke Scare","1100 Block Winding Way, Madison, WI",""
"Oil Heating on Stove Causes $500.00 Damage","01/25/2017","Alarm Investigation","5000 Block Siggelkow Rd, Madison, WI 53718",""
"Arcing Wires Cause Small Fire In Tree","01/25/2017","Power lines down","700 Block Parman Street, Madison, WI 53711",""
"Alert Neighbor Calls Fire Department For Smoke Coming From Apartment","01/24/2017","Cooking","1200 Block E. Gorham Street, Madison, WI 53715",""
"Car Left Running Inside Garage Triggers Carbon Monoxide Alarm","01/24/2017","Carbon Monoxide","1200 Block S. Whitney Way, Madison, WI 53703",""
"Chimney Bomb Puts A Stop To Fire At West Side Home","01/23/2017","Chimney","6400 Block Antietam Ln, Madison, WI",""
"Faulty Electrical Panel Sends Firefighters To Downtown Hotel","01/23/2017","Smoke Scare","600 Block Langdon Street, Madison, WI",""
"Fire At Downtown Construction Site Shuts Down 400 Block of W. Mifflin","01/23/2017","Structure","400 Block W. Mifflin St, Madison, WI 53703",""
"Broken Valve Causes Gas Leak at East Side Home","01/21/2017","Gas Leak","2300 Block Myrtle Street, Madison, WI 53703",""
"Four Displaced By Garage Fire On Tottenham Road","01/20/2017","Structure","6800 Block Tottenham Rd, Madison, WI","Updated: 01/24/2017"
"Burning Wood Smell Traced To Flourescent Light Bulb","01/20/2017","Odor Investigation","1800 Block Windam Way, Madison, WI",""
"MFD On Scene Of Rollover Crash - John Nolen Drive","01/20/2017","Vehicle","John Nolen Drive / East Olin Ave, Madison, WI",""
"Occupants Safely Escape Gas Leak In West Side Home","01/19/2017","Gas Leak","2500 Block Chamberlain Ave, Madison, WI",""
"Vehicle Fire On East Broadway","01/18/2017","Vehicle","East Broadway, Madison, WI",""
"Water Seeps Into Outlet, Kicking Up Smoke At East-Side Motel","01/17/2017","Electrical","3100 Block E. Washington Ave, Madison, WI",""
"Burned Salmon Sends Firefighter To The Hub","01/16/2017","Cooking","400 Block N. Frances St, Madison, WI",""
"Building Evacuated For Carbon Monoxide Leak; Everybody Okay","01/16/2017","Carbon Monoxide","400 Block W. Main Street, Madison, WI 53703",""
"No Known Injuries In East Bluff Car. Vs. Condo Crash","01/16/2017","Vehicle","300 Block East Bluff, Madison, WI 53704",""
"Small Fire Contained, Extinguished Quickly At Loft Apartments","01/14/2017","Trash/Rubbish","100 Block N. Frances Street, Madison, WI",""
"Three Injured In East Washington Crash","01/14/2017","Vehicle","E. Washington Ave. / Pawling St, Madison, WI",""
"Cause of North Side Fire Under Investigation","01/13/2017","Structure","2300 Block Superior Street, Madison, WI","Updated: 01/24/2017"
"Fire In Parking Garage At Normandy Apartments","01/13/2017","Trash/Rubbish","4700 Block Sheboygan Ave, Madison, WI 53703","Updated: 01/19/2017"
"Minor Injuries and Damage Following Cooking Fire","01/11/2017","Cooking","200 Block N. Frances St, Madison, WI",""
"Smoke Scare On North Side; Fire Averted With Early 911 Call","01/10/2017","Odor Investigation","1500 Block Trailsway, Madison, WI",""
"Three Displaced Following East-Side Fire; No Injuries","01/09/2017","Structure","3200 Block Forest Ridge, Madison, WI 53703",""
"Small Fire In Victoria's Secret Changing Room Causes Minor Damage","01/08/2017","Electrical","East Towne Mall, Madison, WI 53703",""
"Engine 4 Responds To Fuel Spill At Area Gas Station","01/08/2017","Outdoor","2500 Block Fish Hatchery Road, Madison, WI",""
"Nobody Injured In Vehicle Fire On Westbound I-90","01/07/2017","Vehicle","Mile Marker 143.8, I-90 Westbound, Madison, WI 53715",""
"Mattress Fire Causes Minor Damage At The Meadows Apartments","01/06/2017","Structure","200 Block N. Thompson Drive, Madison, WI",""
"Elevated Carbon Monoxide Levels Send Firefighters To West Side Apartment","01/05/2017","Carbon Monoxide","200 Block N. Eau Claire Ave, Madison, WI",""
"Two People Transported After Four Vehicle Crash","01/04/2017","Vehicle","S. Gammon Road, Watts Road, Madison, WI",""
"Two People Transported After Four Vehicle Crash","01/04/2017","Vehicle","S. Gammon Road, Watts Road, Madison, WI",""
"West Side Vehicle Fire Under Investigation","01/03/2017","Vehicle","400 Block S. Gammon Rd, Madison, WI",""
"Three Injured In Old Sauk Road Crash","01/03/2017","Vehicle","6200 Block Old Sauk Road, Madison, WI",""
"One Transported From Six-Vehicle Crash On Stoughton Road","01/02/2017","Vehicle","S. Stoughton Rd. / Buckeye Rd, Madison, WI",""
"Woman Struck By Vehicle Suffers Minor Injuries","01/02/2017","Vehicle","E. Washington Ave. & Eagan Rd, Madison, WI",""
"Firefighters Assist Locked-In Mail Carrier On Karstens Drive","12/31/2016","Assist Citizen","East Karstens Drive, Madison, WI 53703",""
"Two Transported Following Chemical Spill","12/31/2016","Hazmat","5800 Block Odana Road, Madison, WI 53703",""
"Damaged Sprinkler Pipe Triggers Alarm At Downtown High Rise","12/28/2016","Water Leak","800 Block E. Washington Ave, Madison, WI",""
"Center Avenue home damaged by fire","12/27/2016","Structure","2700 Block Center Ave, Madison, WI 53704",""
"Firefighters Extinguish Shed Fire","12/25/2016","Structure","3300 Block Atwood Avenue, Madison, WI 53704","Updated: 12/29/2016"
"Two People Rescued After Falling Through Ice","12/24/2016","Lake Rescue","3300 Block Fish Camp Road, McFarland, WI 53558",""
"Man Survives Cardiac Arrest With Help From CPR-Trained Son","12/23/2016","Assist Citizen","600 Block W. Dayton Street, Madison, WI 53703",""
"Firefighters Respond to Fire at SSM Health Care Center","12/23/2016","Structure","3400 Block Maple Grove Drive, Madison, WI 53719","Updated: 12/29/2016"
"Firefighters Investigate Burning Smell Inside East Side Home","12/22/2016","Odor Investigation","1300 Block Meadowlark Drive, Madison, WI",""
"No Injuries Following Jeep Rollover On Milwaukee Street","12/22/2016","Vehicle","Milwaukee Street / Crystal Lane, Madison, WI",""
"Two Rescued From Stalled Elevator","12/21/2016","Elevator","600 Block N. Segoe Road, Madison, WI",""
"Firefighters Help Woman Who Fell In the Snow; Clear A Path To Her Home","12/21/2016","Assist Citizen","600 Block S. Segoe Rd, Madison, WI",""
"Construction Crew Asked To Put Out Fire In "Burn Barrel"","12/20/2016","Outdoor","2600 Block Kendall Ave, Madison, WI",""
"One Removed From Stalled Elevator at Chavez Elementary School","12/19/2016","Elevator","3500 Block Maple Grove Road, Madison, WI",""
"Boiler Malfunction Temporarily Leaves Residents In the Cold","12/18/2016","Odor Investigation","500 Block W. Mifflin Street, Madison, WI",""
"Firefighters Free Man Trapped In Vehicle Hood","12/18/2016","Assist Citizen","2200 Block Catalpa Road, Madison, WI",""
"Unattended Pizza Rolls To Blame For Downtown Smoke Scare","12/16/2016","Smoke Scare","200 Block Langdon Street, Madison, WI",""
"Smoke Alarm Alerts Resident to Fire","12/15/2016","Structure","2000 Block Helena St, Madison, WI",""
"No Injuries In Car-Vs.-Tree Collision","12/14/2016","Vehicle","1600 Block Moorland Rd, Madison, WI",""
"Car Strikes East Towne Store; Nobody Injured","12/14/2016","Vehicle","4700 Block East Towne Blvd, Madison, WI 53703",""
"TV Breakdown Sends Firefighters To West-Side Duplex","12/13/2016","Smoke Scare","8500 Block Elderberry Road, Madison, WI",""
"Vehicle Fire Knocked Down on Pennsylvania Avenue","12/13/2016","Vehicle","2400 Block Pennsylvania Ave, Madison, WI",""
"Driver Uninjured Despite Rollover Crash On Milwaukee Street","12/13/2016","Vehicle","Milwaukee Street / S. Marquette Street, Madison, WI 53703",""
"Crash At Gammon Intersection Causes Injuries","12/12/2016","Vehicle","Gammon Lane / S. Gammon Road, Madison, WI 53703",""
"Two Taken To Hospital Following Traffic Crash","12/10/2016","Vehicle","Millpond Rd. / US Highway 12, Madison, WI",""
"Leaky Water Valve Floods, Significantly Damages West-Side Home","12/10/2016","Water Leak","9200 Block Bear Claw Way, Madison, WI",""
"Firefighters Investigate Gasoline Smell at East-Side Walmart","12/08/2016","Odor Investigation","4100 Block Nakoosa Trail, Madison, WI",""
"Odor Investigation At GEF 4 Building","12/07/2016","Odor Investigation","100 Block East Wilson Street, Madison, WI",""
"Four Displaced Following Fire on Webb Ave.","12/07/2016","Structure","3100 Block Webb Ave, Madison, WI","Updated: 12/08/2016"
"Package Collides With Pipe Causing Water Leak at FedEx","12/05/2016","Water Leak","3900 Block Hanson Road, Madison, WI",""
"Kitchen Fire Totals Appliances; Nobody Injured","12/03/2016","Cooking","400 Block N. Few Street, Madison, WI 53703",""
"Smoke Scare Sends Fire Response To Downtown Parking Garage","12/03/2016","Smoke Scare","10 Block S. Bedford Street, Madison, WI 53703",""
"Small Oven Fire Sends Firefighters To Downtown Home","12/01/2016","Smoke Scare","500 Block W. Washington Ave, Madison, WI 53703",""
"Fire Displaces Person and Pet From Park Street Apartment","11/30/2016","Structure","200 Block S. Park Street, Madison, WI",""
"At Least 10 Displaced From Downtown High Rise","11/30/2016","Structure","100 Block N. Bedford Street, Madison, WI 53703",""
"Three Rescued, Transported Following Rollover Crash","11/30/2016","Vehicle","4800 Block Hayes Road, Madison, WI",""
"Small Umbrella Fire Triggers Alarm Downtown","11/29/2016","Structure","100 Block E. Wilson Street, Madison, WI",""
"Vehicle Fire At Elver Park Believed To Be Accidental","11/29/2016","Vehicle","1200 Block McKenna Blvd, Madison, WI",""
"MFD Called To Spring Harbor Park For Vehicle In Water","11/28/2016","Lake Rescue","Spring Harbor Park, Madison, WI 53705",""
"Nobody Injured In East Side Carbon Monoxide Incident","11/25/2016","Carbon Monoxide","1600 Block Kings Mill Way, Madison, WI",""
"Residents Displaced by East Madison Apartment Fire","11/24/2016","Structure","1300 Block Morrison Street, Madison, WI","Updated: 12/01/2016"
"Small Electrical Fire Caught Early Thanks To Prompt 911 Call","11/23/2016","Electrical","5400 Block University Ave, Madison, WI",""
"Nobody Injured In Vehicle Vs. Building Crash","11/22/2016","Vehicle","6700 Block Odana Road, Madison, WI",""
"Small Oven Fire On Sycamore Ave.","11/21/2016","Cooking","3800 Block Sycamore Ave, Madison, WI",""
"Small Grease Fire Contained At East Towne Restaurant","11/21/2016","Cooking","4300 Block East Towne Blvd, Madison, WI",""
"Fire Causes Extensive Damage, Displacing Two From East-Side Home","11/20/2016","Structure","100 Block Acewood Blvd, Madison, WI",""
"Five Vehicles Damaged By Fire On Bridge Road","11/20/2016","Vehicle","6400 Block Bridge Road, Madison, WI",""
"Chemical Odor On East Johnson Street Identified","11/16/2016","Hazmat","800 Block East Johnson Street, Madison, WI",""
"Tank Ruptures, Spills Gallons Of Diesel At East Wash Intersection","11/15/2016","Vehicle","E. Washington Avenue & S. Patterson Street, Madison, WI",""
"Two Displaced By Small Fire On Calypso Road","11/14/2016","Structure","2500 Block Calypso Road, Madison, WI",""
"Garage Fire On Southwest Side","11/13/2016","Structure","Golden Oak Lane, Madison, WI 53715",""
"Tractor Trailer Clips Electrical Pole","11/09/2016","Electrical","Odana Rd/Monroe Street, Madison, WI",""
"Landscapers Hit Gas Supply Line","11/09/2016","Gas Leak","400 Block Wild Indigo Lane, Madison, WI 53717",""
"Nobody Home When Small Fire Ignites On Outdoor Balcony","11/07/2016","Structure","5100 Block Autumn Leaf Lane, Madison, WI",""
"MFD Called For Windsurfer Believed To Be In Distress","11/07/2016","Lake Rescue","1600 Block East Sherman Ave, Madison, WI 53703",""
"Engine 5 Responds To Dumpster Fire On Femrite Drive","11/06/2016","Trash/Rubbish","4400 Block Femrite Drive, Madison, WI",""
"Rented U-Haul Goes Up In Flames On West Side","11/06/2016","Vehicle","S. Whitney Way / Westbury Place, Madison, WI 53703",""
"Man Attacked By Pet Iguana Is Expected To Make Full Recovery","11/06/2016","Assist Citizen","Near-West Side, Madison, WI 53703",""
"Firefighters Respond To Wood Beam On Fire At Shorewood Hills Home","11/04/2016","Structure","Blackhawk Drive, Shorewood Hills, WI",""
"Books Left On Oven Prompt Fire Department Response Downtown","11/04/2016","Structure","300 Block W. Dayton Street, Madison, WI",""
"Engine 1 Confronts Gas Leak Emergency At "Lucky" Business","11/04/2016","Gas Leak","700 Block University Ave, Madison, WI",""
"Overheated Fan Causes Smoke Scare On UW Campus","11/01/2016","Smoke Scare","1400 Block Engineering Drive, Madison, WI",""
"Fire Quickly Consumes Car In Downtown Madison","11/01/2016","Vehicle","E. Johnson Street / N. Blount Street, Madison, WI",""
"Mixture Of Drain Cleaners Creates Toxic Vapor On North Side","11/01/2016","Hazmat","East Bluff, Madison, WI 53703",""
"Cause Of Allied Drive Trash Fire Unknown","10/30/2016","Trash/Rubbish","2100 Block Allied Drive, Madison, WI",""
"Four Condos, Garages Ventilated Following Carbon Monoxide Spell","10/29/2016","Carbon Monoxide","5000 Block Siggelkow Road, Madison, WI",""
"Clothing Stuffed in Dryer Vent Causes Fire Damage","10/29/2016","Structure","1100 Block Woodvale Drive, Madison, WI",""
"Two Injured In Stoughton Road Crash","10/28/2016","Vehicle","S. Stoughton Rd. / Cottage Grove Rd, Madison, WI",""
"Student Cited For Fire At UW Dormitory","10/28/2016","Structure","600 Block W. Johnson Street, Madison, WI",""
"Driver Uninjured After Vehicle Rolls Into Construction Pit","10/26/2016","Vehicle","Hammersley Road / S. Midvale Boulevard, Madison, WI",""
"Automatic Sprinkler Puts Stop To Fire At West Side Retail Store","10/26/2016","Structure","7400 Block Mineral Point Road, Madison, WI","Updated: 10/26/2016"
"Small Fire In Duct System At Local Manufacturing Plant","10/24/2016","Structure","1000 Block E. Main Street, Madison, WI 53703",""
"Cat Stranded On Rooftop Returns To Owner's Arms","10/23/2016","Special Rescue","500 Block Wynnwood Way, Madison, WI",""
"Distracted Driving Leads To Single-Vehicle Rollover On East Side","10/23/2016","Vehicle","W. Corporate Drive / Milwaukee Street, Madison, WI",""
"Brewing Kitchen Fire Caught Early Thanks To Alert Neighbor","10/22/2016","Cooking","100 Block S. Mills Street, Madison, WI",""
"Multiple Vehicle Accident on I-90","10/22/2016","Vehicle","Interstate 90, Madison, WI",""
"Kitchen Stove Used As Home Heat Source Triggers CO Alarm","10/22/2016","Carbon Monoxide","2800 Block Curry Parkway, Madison, WI",""
"Cooking Fire On North Side","10/21/2016","Cooking","1500 Block Troy Drive, Madison, WI",""
"Child Freed From Infant Swing At Local Park","10/20/2016","Assist Citizen","1600 Block Frisch Rd, Madison, WI",""
"Two-Car Crash At Packers Ave. Intersection","10/19/2016","Vehicle","Packers Ave. / International Ln, Madison, WI",""
"Empty Boat Sends Rescuers To Lake Monona","10/19/2016","Lake Rescue","Lake Monona, Madison, WI",""
"Engine 13 Responds To Residential Carbon Monoxide Leak","10/18/2016","Carbon Monoxide","100 Block Andrew Way, Madison, WI",""
"Paramedic Pushes Past Dog Bite To Revive Pulseless Patient","10/18/2016","Assist Citizen","West Side, Madison, WI 53706",""
"One Injured In Attempt To Avoid Collision Downtown","10/18/2016","Vehicle","N. Bassett Street / W. Dayton Street, Madison, WI",""
"Seven Taken To Hospital Following Crash On John Nolen Drive","10/16/2016","Vehicle","John Nolen Drive / North Shore Drive, Madison, WI",""
"Nobody Home As Carbon Monoxide Triggers Alarm In Downtown Apartment","10/16/2016","Carbon Monoxide","300 Block S. Hamilton Street, Madison, WI",""
"Firefighters Respond To Kitchen Fire On Near East Side","10/14/2016","Cooking","600 Block E. Johnson Street, Madison, WI",""
"One Injured In Early-Morning Crash","10/14/2016","Vehicle","Whitney Way / Mineral Point Road, Madison, WI",""
"Student Burns Bagels In Dorm Room; Intoxication A Factor","10/14/2016","Cooking","800 Block W. Johnson Street, Madison, WI",""
"One Rescued From East Towne Elevator","10/13/2016","Elevator","East Towne Mall, Madison, WI",""
"Lightning Strike The Suspected Cause Of Fire At Madison Sewerage Plant","10/12/2016","Structure","1600 Block Moorland Rd, Madison, WI",""
"Extensive Damage in High Rise Building Near Beltline","10/07/2016","Structure","2600 Block West Beltline Highway, Madison, WI",""
"Apartment Complex Evacuated After Carbon Monoixde Incident","10/06/2016","Carbon Monoxide","1400 Block Wayridge Drive, Madison, WI 53704",""
"Citizen Reports Smoking Washer in Laundry Mat","10/06/2016","Smoke Scare","900 Block Atlas Ave, Madison, WI 53714",""
"East Side Fire Results In $100,000 Loss; Family And Pets Okay","10/05/2016","Structure","5600 Block Rustic Woods Drive, Madison, WI",""
"Faulty Oven To Blame For Carbon Monoxide Leak On East Gorham","10/04/2016","Carbon Monoxide","1200 Block East Gorham St, Madison, WI 53703",""
"Five-Vehicle Crash On Seminole Highway","10/04/2016","Vehicle","Seminole Highway / Nakoma Road, Madison, WI 53703",""
"Nobody Injured After Crash Into North Side Credit Union","10/04/2016","Vehicle","1400 Block Northport Drive, Madison, WI 53703",""
"Apartment Suffers Smoke Damage Following Cooking Fire","10/02/2016","Cooking","200 Block Langdon Street, Madison, WI 53703",""
"One Pinned, Transported Following Early-Morning Crash","10/01/2016","Vehicle","N. Whitney Way / University Ave, Madison, WI",""
"North Side Dumpster Fire Under Investigation","09/30/2016","Trash/Rubbish","2800 Block Dryden Drive, Madison, WI",""
"Plugged Dryer Vent Kicks Up Smoke On Fourth Street","09/30/2016","Appliance","100 Block N. Fourth Street, Madison, WI 53703",""
"Oven Mitt Catches On Fire Inside Broiler","09/29/2016","Cooking","1000 Block Drake Street, Madison, WI",""
"Several Residents Affected By Power Outage After Apparent Hit-And-Run","09/27/2016","Electrical","5600 Block Old Middleton Road, Madison, WI",""
"Kitchen Fire Averted Thanks To Alert Neighbor","09/27/2016","Smoke Scare","1500 Block Trailsway, Madison, WI",""
"Tangled Cable Wires Temporarily Shut Down Stoughton Road Early Tuesday Morning","09/27/2016","Electrical","S. Stoughton Rd. / U.S. Highway 12, Madison, WI",""
"Engine 10 Responds To Gasoline Spill At North Side Parking Lot","09/26/2016","Vehicle","1800 Block Aberg Ave, Madison, WI",""
"Capitol Police Put A Stop To Vehicle Fire On the Square; Cause Unknown","09/26/2016","Vehicle","W. Main Street / S. Carroll Street, Madison, WI",""
"Ladder 2 Called To Possible Fire Off Beltline After Debris Catches Onto Passing Vehicle","09/26/2016","Vehicle","Mineral Point Rd. / Junction Rd, Madison, WI",""
"Three People Safe After Fire Consumes Vehicle On Northport Drive","09/25/2016","Vehicle","Northport Drive / Troy Drive, Madison, WI",""
"Firefighters Called For Waste Burning On Troy Drive","09/24/2016","Outdoor","1000 Block Troy Drive, Madison, WI",""
"Smoke Complaint Reveals Illegal Pig Roast On Pinckney","09/23/2016","Outdoor","300 Block N. Pinckney Street, Madison, WI",""
"Fog Machine Causes Smoke Scare On Jenifer Street","09/22/2016","Smoke Scare","1200 Block Jenifer Street, Madison, WI",""
"Passerby Catches Kitchen Fire Early On South Shore Drive","09/22/2016","Structure","500 Block South Shore Drive, Madison, WI",""
"Power Outage Disrupts Kitchen Operations At Segoe Gardens","09/22/2016","Smoke Scare","600 Block N. Segoe Road, Madison, WI",""
"Dancing In Dorm Elevator Leaves Two Students Stranded","09/21/2016","Elevator","10 Block N. Park Street, Madison, WI",""
"Carbon Monoxide From Running Car Affects Three Neighboring Condos","09/21/2016","Carbon Monoxide","3700 Block Design Pass, Madison, WI",""
"Lightning Strike Takes Out Electric Meter At Johnson Street Business","09/21/2016","Structure","1900 Block East Johnson Street, Madison, WI",""
"Fire Department, Other City Agencies Called For Flooded Basement at East Side YMCA","09/21/2016","Water Leak","700 Block Cottage Grover Road, Madison, WI",""
"Severed Power Line Causes Estimated $2000 In Damage On Maher Ave.","09/21/2016","Electrical","5100 Block Maher Ave, Madison, WI",""
"Smoldering Trash Bin Discovered Downtown","09/20/2016","Trash/Rubbish","500 Block East Johnson Street, Madison, WI",""
"Flooded Intersection Leaves Three Vehicles Stranded; One Passenger Rescued","09/19/2016","Vehicle","Rose Place / University Ave, Madison, WI",""
"Ladder 6 Called To Limousine Fire","09/17/2016","Vehicle","Baird Street / Bram Street, Madison, WI",""
"Fire Department Dispatched For Struggling Kayaker; Finds Frolicking Beaver","09/16/2016","Lake Rescue","Lake Monona, Madison, WI",""
"Gas Leak Prompts Downtown Building Evacuation","09/16/2016","Gas Leak","400 Block N. Pinckney Street, Madison, WI 53703",""
"Motorist Drives Off After Gasoline Ignites At Gas Station","09/15/2016","Outdoor","3000 Block East Washington Ave, Madison, WI",""
"Soldering Project Ignites Accidental Fire On Bassett Street","09/14/2016","Structure","10 Block N. Bassett Street, Madison, WI",""
"Four Displaced After Fire Spreads In Northside Kitchen","09/13/2016","Structure","400 Block Troy Drive, Madison, WI",""
"Firefighters Called For Malfunctioning Elevator At UW Dorm","09/13/2016","Elevator","800 Block W. Johnson Street, Madison, WI",""
"Melted Bottle Cap To Blame For Mysterious Odor In East Side Home","09/13/2016","Odor Investigation","6800 Block Fieldwood Road, Madison, WI",""
"Unattended Cooking Fire Displaces Family, Pets On Piccadilly Drive","09/13/2016","Cooking","5200 Block Piccadilly Drive, Madison, WI",""
"Smoke Under Mobile Home Traced To Burned Wires","09/11/2016","Electrical","400 Block Warbler Lane, Madison, WI",""
"Faulty Battery Likely Cause Of Fire Door Activation At Area Food Bank","09/09/2016","Electrical","2800 Block Dairy Drive, Madison, WI",""
"One Pinned, Transported Following Crash On Schroeder Road","09/07/2016","Vehicle","6700 Block Schroeder Road, Madison, WI","Updated: 09/07/2016"
"All OK After Apartment Building Is Evacuated For Suspected Gas Leak","09/07/2016","Gas Leak","2900 Block Curry Parkway, Madison, WI",""
"Automatic Sprinkler Quickly Catches Kitchen Fire at Downtown Restaurant","09/07/2016","Cooking","400 Block State Street, Madison, WI",""
"Dryer Fire Scare on Mifflin Street","09/06/2016","Structure","500 Block Mifflin Street, Madison, WI 53703",""
"Witnesses Report "Mini-Motorcycle" On Fire On East Side Bridge","09/06/2016","Vehicle","N. Marquette Street / Darbo Drive, Madison, WI",""
"Oven Catches Fire On Mayfair Ave.","09/05/2016","Structure","1000 Block Mayfair Ave, Madison, WI",""
"Firefighters Respond To Cooking Fire On Moorland Road","09/04/2016","Cooking","1100 Block Moorland Rd, Madison, WI",""
"Smoke Scare Uncovers Overloaded Power Strip In Downtown Condo","09/03/2016","Smoke Scare","300 Block S. Hamilton Street, Madison, WI",""
"Commercial Oven Fire","09/02/2016","Cooking","","Updated: 09/07/2016"
