Incident,Date,Incident Type,Address,Time
"Smoke Scare Inside Downtown Bar Traced To Arcade Games","03/08/2019","Smoke Scare","500 Block W. Main Street, Madison, WI","2019-03-08T21:25:00-06:00"
"Engine 8 Responds To Vehicle Fire On Highway 30","03/08/2019","Vehicle","Highway 30 westbound, Madison, WI","2019-03-08T16:28:00-06:00"
"Driver Uninjured In Northside Rollover Crash","03/04/2019","Vehicle","Northport Drive & Kennedy Road, Madison, WI","2019-03-04T05:14:00-06:00"
"Family Escapes Early Morning Home Fire","02/27/2019","Structure","2600 Block Frazier Avenue, Madison, WI","2019-02-27T04:47:00-06:00"
"MFD & MGE Investigating Natural Gas Odor On West Side","02/26/2019","Gas Leak","N. High Point Road & Old Sauk Road, Madison, WI","2019-02-26T11:59:00-06:00"
"Fire In Chamberlin Hall Caught By Automatic Fire Sprinkler","02/20/2019","Structure","1100 Block University Avenue, Madison, WI","2019-02-20T23:06:00-06:00"
"Mysterious Smoke In East-Side Apartment Traced To Burned Food Downstairs","02/19/2019","Cooking","400 Block S. Livingston Street, Madison, WI","2019-02-19T00:48:00-06:00"
"Sparks Fly, Igniting Couch Cushion In West Side Apartment","02/18/2019","Electrical","7000 Block Tree Lane, Madison, WI","2019-02-18T21:13:00-06:00"
"Mysterious Symptoms Lead Firefighters To Find Man 'Practicing With Pepper Spray'","02/14/2019","Hazmat","2300 Block Talc Trail, Madison, WI","2019-02-14T18:51:00-06:00"
"Woman Falls Through Ice Into Waist-Deep Water Near Spring Harbor Park","02/14/2019","Lake Rescue","Lake Mendota, Madison, WI","2019-02-14T12:19:00-06:00"
"Fire On Franklin Avenue Traced To Discarded Cigarettes","02/12/2019","Smoking","10 Block N. Franklin Ave, Madison, WI","2019-02-12T14:55:00-06:00"
"Ladder 7 Responds To Vehicle Fire At West Towne Mall","02/12/2019","Vehicle","10 Block West Towne Mall, Madison, WI","2019-02-12T12:43:00-06:00"
"Fire Displaces Several Occupants From Complex On Luann Lane","02/11/2019","Structure","2100 Block Luann Lane, Madison, WI","2019-02-11T14:34:00-06:00"
"Vehicle A Total Loss After Charcoal Placed Underneath It Leads To Fire","01/31/2019","Vehicle","3700 Block Karstens Drive, Madison, WI","2019-01-31T12:37:00-06:00"
"Three Become Ill From Carbon Monoxide Leak","01/31/2019","Carbon Monoxide","2100 Block University Avenue, Madison, WI","2019-01-31T12:28:00-06:00"
"Attempt To Thaw Pipes Leads To Fire Inside Basement Wall","01/30/2019","Structure","4100 Block Mineral Point Road, Madison, WI","2019-01-30T18:05:00-06:00"
"Automatic Fire Sprinkler Keeps Fire Contained At West Side Apartment Complex","01/30/2019","Structure","6700 Block Mader Drive, Madison, WI","2019-01-30T14:27:00-06:00"
"Fire Crews Battle House Fire In Bitter Cold Temperatures","01/30/2019","Structure","4800 Block Buckeye Rd, Madison, WI 53716","2019-01-30T02:59:00-06:00"
"Smoldering Booklet Left On Top Of Furnace Triggers Smoke Detector","01/29/2019","Structure","300 Block S. Park Street, Madison, WI","2019-01-29T06:37:00-06:00"
"Pipes Burst Inside Vacant Building On International Lane","01/28/2019","Water Leak","2900 Block International Lane, Madison, WI","2019-01-28T09:29:00-06:00"
"Nineteen Residents Displaced By Morning Fire","01/27/2019","Structure","4700 Block Cottage Grove Rd, Madison, WI 53716","2019-01-27T06:07:00-06:00"
"Nobody Injured After Snow Is Tossed On Pan Of Burning Oil","01/24/2019","Cooking","700 Block N. Thompson Drive, Madison, WI","2019-01-24T19:32:00-06:00"
"Automatic Sprinkler Extinguishes Fire, Contains Damage In UW Campus Building","01/21/2019","Alarm Investigation","1500 Block Engineering Drive, Madison, WI","2019-01-21T13:07:00-06:00"
"Crews Called To Investigate Smoke Inside Northside McDonald's","01/21/2019","Smoke Scare","2900 Block Dryden Drive, Madison, WI","2019-01-21T00:51:00-06:00"
"Four Rescued From Campus-Area Elevator","01/19/2019","Elevator","300 Block N. Lake Street, Madison, WI 53706","2019-01-19T12:39:00-06:00"
"Cracked Candle Leaks Wax, Starts Fire In East Side Apartment","01/18/2019","Candle","1000 Block Spaight Street, Madison, WI","2019-01-18T09:39:00-06:00"
"Vehicle Strikes House, Ruptures Gas Line, Prompting Temporary Evacuation On Near East Side","01/17/2019","Gas Leak","1000 Block E. Dayton Street, Madison, WI","2019-01-17T21:30:00-06:00"
"Engine 1 Called To Investigate Gas Leak In Downtown Apartment","01/11/2019","Gas Leak","500 Block W. Wilson Street, Madison, WI 53703","2019-01-11T17:08:00-06:00"
"Tarps and Wood Catch Fire Outside West Side Home","01/10/2019","Outdoor","800 Block Blue Aster Trail, Madison, WI","2019-01-10T17:56:00-06:00"
"Winds Cause Garage Fire to Spread to House","01/08/2019","Structure","700 Block Dempsey, Madison, WI 53714","2019-01-08T16:53:00-06:00"
"Bumped Burner Ignites Air Fryer, Sending Engine 9 To West Side Home","01/07/2019","Cooking","600 Block N. Blackhawk Drive, Madison, WI","2019-01-07T19:50:00-06:00"
"Lake Rescue Team Called To Lake Monona Overnight","01/04/2019","Lake Rescue","Lake Monona, Madison, WI","2019-01-04T02:30:00-06:00"
"Nobody Displaced Following Cooking Fire On Catalpa Circle","01/01/2019","Cooking","Catalpa Circle, Madison, WI","2019-01-01T00:23:00-06:00"
"Man Rescued From Lake Monona After Wandering Onto Thin Ice","12/26/2018","Lake Rescue","Lake Monona, Madison, WI","2018-12-26T12:26:00-06:00"
"Paramedics Revive Pulseless Semi Driver On Christmas Eve","12/24/2018","EMS","Westgate Mall, Madison, WI","2018-12-24T11:28:00-06:00"
"Vehicle Fire Extinguished Early By Gas Station Employee","12/23/2018","Vehicle","2500 Block Fish Hatchery Road, Madison, WI","2018-12-23T10:39:00-06:00"
"Overheated Oil Leads To Cooking Fire","12/20/2018","Cooking","7700 Block Carrington Ave, Madison, WI","2018-12-20T18:30:00-06:00"
"Propane Torch Test Linked To Vehicle Fire In Mall Parking Lot","12/19/2018","Vehicle","400 Block N. Midvale Blvd, Madison, WI","2018-12-19T13:43:00-06:00"
"Paramedics Assist Man Needing Oxygen In Wake Of Power Outage","12/18/2018","Assist Citizen","Lakeview Hills Neighborhood, Madison, WI 53704","2018-12-18T21:21:00-06:00"
"One Critically Injured In Single-Vehicle Crash","12/18/2018","Vehicle","Wheeler Rd. & School Rd, Madison, WI","2018-12-18T20:26:00-06:00"
"Fire in West Side Home Displaces 5 People","12/14/2018","Structure","5900 Block Meadowood Drive, Madison, WI","2018-12-14T15:50:00-06:00"
"Engine 5 Called To Check On Garbage Truck After Contents Catch Fire","12/12/2018","Vehicle","US Hwy 12 Eastbound & I-90 Westbound, Madison, WI","2018-12-12T10:38:00-06:00"
"Two Taken To Hospital Following Crash On Interestate Highway","12/11/2018","Vehicle","Westbound I-90, Madison, WI","2018-12-11T09:53:00-06:00"
"Person Getting Off Bus Smells Something Burning and Notices Smoke Coming From Home","12/06/2018","Structure","200 Block N. Owen Drive, Madison, WI 53705","2018-12-06T16:28:00-06:00"
"Fire Breaks Out In UW Campus Laboratory","12/03/2018","Structure","1500 Block Engineering Drive, Madison, WI 53706","2018-12-03T08:44:00-06:00"
"Garage Fire Displaces Two On Offshore Drive","12/01/2018","Structure","6300 Block Offshore Drive, Madison, WI","2018-12-01T02:42:00-06:00"
"Pots Left On Stovetop Send Firefighters To Downtown Restaurant","11/30/2018","Smoke Scare","W. Mifflin Street, Madison, WI 53703","2018-11-30T04:28:00-06:00"
"Carbon Monoxide Linked To Running Vehicle","11/29/2018","Carbon Monoxide","Brompton Circle, Madison, WI","2018-11-29T08:03:00-06:00"
"Car Left Running Kicks Up Carbon Monoxide In West Side Home","11/27/2018","Carbon Monoxide","Wyota Avenue, Madison, WI","2018-11-27T19:56:00-06:00"
"Firefighters P.A.S.S. Along Fire Extinguisher Tips After Fire Breaks Out In North Side Home","11/27/2018","Cooking","Brown Lane, Madison, WI","2018-11-27T14:38:00-06:00"
"Noxious Odor Sends One To Hospital, Hazmat Team Called To Mobile Home Park","11/19/2018","Hazmat","Malibu Drive, Madison, WI","2018-11-19T08:26:00-06:00"
"Smoke Alarm Alerts Residents to Early Morning Fire","11/18/2018","Structure","6300 Block Alison Lane, Madison, WI","2018-11-18T03:10:00-06:00"
"Occupant Extinguishes Cooking Fire With Lid Of A Frying Pan","11/17/2018","Cooking","100 Block E. Johnson Street, Madison, WI","2018-11-17T11:32:00-06:00"
"Fire Displaces Eleven From Northside Apartment Complex","11/14/2018","Structure","2300 Block Brentwood Parkway, Madison, WI","2018-11-14T15:08:00-06:00"
"Towel Resting On Night Light Catches Fire","11/14/2018","Structure","6700 Block Village Park Drive, Madison, WI","2018-11-14T00:20:00-06:00"
"One Person Arrested, Charged With Arson At West Side Transit Site","11/09/2018","Structure","5600 Block Tokay Blvd, Madison, WI","2018-11-09T01:37:00-06:00"
"Carbon Monoxide Incident Prompts Evacuation Of Apartment Complex","11/09/2018","Carbon Monoxide","4700 Block Jenewein Road, Madison, WI","2018-11-09T01:18:00-06:00"
"Three Injured In Mineral Point Road Crash","11/08/2018","Vehicle","Mineral Point Road & Rose Road, Madison, WI","2018-11-08T13:31:00-06:00"
"Fire Breaks Out After Cook Steps Away From Stove","11/06/2018","Cooking","1100 Block Morraine View Drive, Madison, WI","2018-11-06T18:13:00-06:00"
"Engine 9 Responds To Vehicle Fire","11/03/2018","Vehicle","2700 Block University Avenue, Madison, WI","2018-11-03T23:41:00-05:00"
"Water Problem At Downtown Condo Traced To Tampered Standpipe System","11/03/2018","Water Leak","100 Block Wisconsin Avenue, Madison, WI","2018-11-03T07:36:00-05:00"
"Heavy Smoke Produced By Leaf Burning Sends Firefighters To West Side Home","11/01/2018","Outdoor","4800 Block Regent Street, Madison, WI","2018-11-01T16:58:00-05:00"
"Damaged Water Heater Causes Carbon Monoxide Leak","10/31/2018","Carbon Monoxide","100 Block Division Street, Madison, WI","2018-10-31T20:30:00-05:00"
"Horse Kicks Back, Sending One To Hospital","10/31/2018","EMS","2000 Block Linden Drive, Madison, WI","2018-10-31T15:55:00-05:00"
"Lightning Strike Scorches Phone System In Northside Condominiums","10/30/2018","Lightning Strike","Cherokee Circle, Madison, WI","2018-10-30T14:21:00-05:00"
"Firefighters Respond To Gas Leak On East Side","10/29/2018","Gas Leak","1100 Block E. Mifflin Street, Madison, WI","2018-10-29T22:34:00-05:00"
"Willy Street Crash Sends Two To Hospital","10/28/2018","Vehicle","Williamson Street & Ingersoll Street, Madison, WI","2018-10-28T22:01:00-05:00"
"Vehicle Flees After Striking Ambulance On East Washington Avenue","10/28/2018","Vehicle","E. Washington Avenue & Portage Road, Madison, WI","2018-10-28T18:54:00-05:00"
"One Injured In Collision With Tree","10/27/2018","Vehicle","2300 Block Prairie Road, Madison, WI","2018-10-27T03:46:00-05:00"
"Furnace Problem Kicks Up Carbon Monoxide In Northside Home","10/26/2018","Carbon Monoxide","1000 Block Monica Lane, Madison, WI","2018-10-26T01:46:00-05:00"
"Car Takes Off, Crashes Through Home, As Medics Attempt To Contact Driver","10/21/2018","Vehicle","10 Block Madeline Island, Madison, WI","2018-10-21T10:56:00-05:00"
"Stove Fire Sends Crews To East Side Residence","10/21/2018","Appliance","500 Block Walton Place, Madison, WI","2018-10-21T09:57:00-05:00"
"Ten Rescued From Hotel Elevator","10/20/2018","Elevator","600 Block Langdon Street, Madison, WI","2018-10-20T22:08:00-05:00"
"Firefighters Assist Woman Who Fell Inside Her Home","10/20/2018","Assist Citizen","1900 Block Atwood Avenue, Madison, WI","2018-10-20T12:55:00-05:00"
"Large Tree Limb Takes Down Power Lines, Garage","10/20/2018","Power lines down","4200 Block Doncaster Drive, Madison, WI","2018-10-20T11:26:00-05:00"
"Overheated Elevator Motor Sends Firefighters To Apartment Complex","10/19/2018","Elevator","1600 Block Fordem Ave, Madison, WI","2018-10-19T07:29:00-05:00"
"Firefighters Assist Child Locked In Vehicle","10/18/2018","Lock out/Lock in","300 Block Wisconsin Avenue, Madison, WI","2018-10-18T15:01:00-05:00"
"Discarded Cigarette Starts Fire In City Sewer","10/18/2018","Smoke Scare","200 Block W. Gorham Street, Madison, WI","2018-10-18T14:42:00-05:00"
"Fire Damages Construction Site On Manufacturers Drive","10/17/2018","Structure","6500 Block Manufacturers Drive, Madison, WI","2018-10-17T11:01:00-05:00"
"Beetles Caught In Light Fixture Cause Smoke Scare In Area Home","10/16/2018","Smoke Scare","1400 Block Vilas Avenue, Madison, WI","2018-10-16T19:02:00-05:00"
"Firefighters Respond To Carbon Monoxide Leak At Area Restaurant","10/15/2018","Carbon Monoxide","7000 Block Mineral Point Road, Madison, WI","2018-10-15T07:05:00-05:00"
"Incense Placed In Roll Of Toilet Paper Leads To Bathroom Fire","10/12/2018","Structure","800 Block Vernon Ave, Madison, WI","2018-10-12T15:42:00-05:00"
"Two Taken To Hospital Following Downtown Crash","10/11/2018","Vehicle","W. Johnson Street & Broom Street, Madison, WI 53703","2018-10-11T11:03:00-05:00"
"Firefighters Respond To Reports Of Smoke, Find Burned Pizzas and Intoxicated Occupant","10/10/2018","Cooking","1600 Block Lake Point Drive, Madison, WI","2018-10-10T21:18:00-05:00"
"Wash Machine Malfunction Sends Firefighters To Apartment Complex","10/10/2018","Appliance","500 Block University Ave, Madison, WI","2018-10-10T17:15:00-05:00"
"Driver Injured In Crash At Willy Street Intersection","10/08/2018","Vehicle","600 Block Williamson Street, Madison, WI 53703","2018-10-08T19:28:00-05:00"
"Car Pulls Away From Gas Pump, Leading To A Fuel Spill","10/08/2018","Fuel Spill","3800 Block East Washington Ave, Madison, WI","2018-10-08T17:01:00-05:00"
"Woman Treated, Transported After Being Struck By Vehicle","10/05/2018","EMS","Langdon Street & Henry Street, Madison, WI","2018-10-05T00:02:00-05:00"
"Charcoal May Have Contributed To Stovetop Fire","10/04/2018","Cooking","2900 Block Curry Parkway, Madison, WI","2018-10-04T13:35:00-05:00"
"Firefighters Pinpoint Carbon Monoxide Leak To Oven","10/02/2018","Carbon Monoxide","2000 Block Monroe Street, Madison, WI","2018-10-02T20:07:00-05:00"
"Nakoma Road Fire Under Investigation","09/28/2018","Structure","3800 Block Nakoma Road, Madison, WI","2018-09-28T07:33:00-05:00"
"Straw Catches Fire On Back Of Freight Liner","09/27/2018","Vehicle","County Highway AB & US Highway 12, Madison, WI","2018-09-27T12:57:00-05:00"
"Downtown Residents Experience Similar Symptoms; Bear Repellant To Blame","09/25/2018","Odor Investigation","400 Block W. Johnson Street, Madison, WI 53703","2018-09-25T19:59:00-05:00"
"Rollover Crash On University Avenue Sends One To Hospital","09/24/2018","Vehicle","University Avenue & University Bay Drive, Madison, WI","2018-09-24T14:30:00-05:00"
"Vehicle Fire Traced To Improperly Stowed Gas Cylinder","09/24/2018","Vehicle","S. Stoughton Road & E. Broadway, Madison, WI","2018-09-24T13:34:00-05:00"
"Carelessly Discarded Cigarettes Start Two Balcony Fires On East Side","09/22/2018","Smoking","1600 Block Fordem Ave, Madison, WI","2018-09-22T22:33:00-05:00"
"East Side Gas Leak Prompts Reminder To Call Digger's Hotline","09/22/2018","Gas Leak","5300 Block Forge Drive, Madison, WI","2018-09-22T13:59:00-05:00"
"Occupant Grills Under Garage Overhang, Melting Door","09/15/2018","Structure","900 Block N. Thompson Dr, Madison, WI 53704","2018-09-15T14:42:00-05:00"
"Car Crashes Into East Side Business, Driver Injured","09/15/2018","Vehicle","2800 Block E. Washington Ave, Madison, WI","2018-09-15T12:30:00-05:00"
"Ladder Company 6 Assists Man Who Fell While Mowing The Lawn","09/12/2018","EMS","Arbor Hills Neighborhood, Madison, WI","2018-09-12T15:12:00-05:00"
"Carbon Monoxide Leak Traced To New Oven","09/12/2018","Carbon Monoxide","Dudgeon-Monroe Neighborhood, Madison, WI","2018-09-12T10:57:00-05:00"
"Moped Fire In Underground Garage Contained By Automatic Sprinkler","09/12/2018","Vehicle","100 Block N. Bedford Street, Madison, WI","2018-09-12T08:51:00-05:00"
"Neighbor Puts A Stop To Fire Inside Oven","09/08/2018","Cooking","700 Block Braxton Place, Madison, WI","2018-09-08T23:17:00-05:00"
"Engine 8 Called To Vehicle Fire On the Interstate","09/08/2018","Vehicle","I-90 (westbound), Madison, WI","2018-09-08T20:12:00-05:00"
"Memorial Union Evacuated Briefly Thursday Night; No Gas Leak Found","09/06/2018","Gas Leak","800 Block Memorial Union, Madison, WI 53706","2018-09-06T22:18:00-05:00"
"Paramedics Deliver Two Babies In Two Days","09/06/2018","EMS","Madison, WI","2018-09-06T21:23:00-05:00"
"Stinky Smoke Summons Engine 5 To Unattended Backyard Fire","09/06/2018","Outdoor","600 Block Merryturn Road, Madison, WI","2018-09-06T18:53:00-05:00"
"Lake Rescue Team Responds To Juvenile In Distress On Lake Monona","09/04/2018","Lake Rescue","Lake Monona, Madison, WI","2018-09-04T11:41:00-05:00"
"Smoke-Charged Electrical Outlet Likely The Result Of Lightning Strike","09/03/2018","Electrical","3900 Block Cosgrove Drive, Madison, WI","2018-09-03T09:57:00-05:00"
"One Taken To Hospital Following Rollover Crash","09/01/2018","Vehicle","7600 Block Farmington Way, Madison, WI","2018-09-01T20:07:00-05:00"
"Dishwasher Fire Causes Damage, Displacing One On East Side","08/30/2018","Appliance","500 Block Meadowlark Drive, Madison, WI","2018-08-30T19:17:00-05:00"
"Maggot-Killing Plot Turns Toxic After Household Cleaners Combine","08/28/2018","Hazmat","Aztalan Drive, Madison, WI","2018-08-28T18:24:00-05:00"
"Carbon Monoxide Leak Found At Downtown Restaurant","08/25/2018","Carbon Monoxide","200 Block State Street, Madison, WI 53703","2018-08-25T00:41:00-05:00"
"Vehicle Fire Briefly Threatens Downtown Apartment Building","08/21/2018","Vehicle","200 Block N. Pinckney Street, Madison, WI","2018-08-21T21:20:00-05:00"
"Search Underway For Missing Man Swept Away In West Side Floods","08/20/2018","Assist Citizen","Piping Rock Road & Chapel Hill Road, Madison, WI 53711","2018-08-20T21:07:00-05:00"
"Madison Fire Department Responds To Over 100 Flood-Related Emergencies","08/20/2018","Special Rescue","Madison, WI","2018-08-20T17:21:00-05:00"
"Early Morning House Fire on Madison's West Side","08/19/2018","Structure","4600 Block Gray Fox Trail, Madison, WI","2018-08-19T04:21:00-05:00"
"Carpet Cleaning Solution Kicks Up Carbon Monoxide At University Ave. Apartments","08/14/2018","Carbon Monoxide","2300 Block University Avenue, Madison, WI","2018-08-14T21:41:00-05:00"
"Neighbor Alerts Firefighters To Smoking Futon","08/13/2018","Structure","200 Block Waubesa Street, Madison, WI","2018-08-13T23:10:00-05:00"
"Fire At Greystone Condominiums Displaces 18","08/13/2018","Structure","700 Block Cricket Lane, Madison, WI","2018-08-13T10:29:00-05:00"
"Driver Injured After Crashing Into Building","08/11/2018","Vehicle","3700 Block University Avenue, Madison, WI","2018-08-11T00:58:00-05:00"
"Illegal Mattress Burning Sends Engine 4 To Lathrop Street","08/07/2018","Unauthorized Burning","100 Block Lathrop Street, Madison, WI","2018-08-07T23:27:00-05:00"
"Fire Displaces Multiple East Side Residents, Cause Under Investigation","08/07/2018","Structure","5000 Block Pendleton Drive, Madison, WI","2018-08-07T20:54:00-05:00"
"Cooking Fire Prompts Safety Reminders For Dealing With Oil-Based Flames","08/05/2018","Cooking","Siggelkow Road, Madison, WI","2018-08-05T12:10:00-05:00"
"Engine 4 Discovers Garage Fire On Allen Street, Cause Under Investigation","07/31/2018","Structure","200 Block N. Allen Street, Madison, WI","2018-07-31T00:25:00-05:00"
"Nobody Injured In Car-Versus-Building Crash","07/30/2018","Vehicle","500 Block S. Midvale Blvd, Madison, WI","2018-07-30T20:32:00-05:00"
"Two Injured In Rollover Crash","07/28/2018","Vehicle","East Pass & S. Stone Creek Circle, Madison, WI","2018-07-28T00:56:00-05:00"
"Fire Found Between Orpheum Theater and Parking Ramp; Cause Unknown","07/27/2018","Structure","200 Block N. Carroll Street, Madison, WI","2018-07-27T17:55:00-05:00"
"Bystander Extinguishes Fire Early, Saving Vehicle and Food Cart","07/26/2018","Vehicle","2900 Block East Washington Avenue, Madison, WI","2018-07-26T13:32:00-05:00"
"Clothes Catch Fire, Dryer Removed From East Side Home","07/24/2018","Appliance","500 Block North Star Drive, Madison, WI","2018-07-24T21:42:00-05:00"
"Crews Respond To Significant Gasoline Spill On West Side","07/24/2018","Hazmat","7700 Block Mineral Point Road, Madison, WI","2018-07-24T11:18:00-05:00"
"No Damage Or Injuries Following Contained Fireplace Explosion","07/19/2018","Appliance","6200 Block Seven Pines Avenue, Madison, WI","2018-07-19T22:14:00-05:00"
"Fire Totals Mobile Food Cart","07/18/2018","Vehicle","600 Block Post Road, Madison, WI","2018-07-18T20:04:00-05:00"
"Grease Fire Melts Vinyl Siding","07/18/2018","Structure","5400 Block Katie Lane, Madison, WI","2018-07-18T16:58:00-05:00"
"Frayed Electrical Wires Lead To Fire In East Side Attic","07/16/2018","Structure","1100 Block Mifflin Street, Madison, WI","2018-07-16T19:22:00-05:00"
"Laptop Pops, Smokes Up Downtown Apartment","07/16/2018","Explosion","300 Block W. Main Street, Madison, WI","2018-07-16T17:51:00-05:00"
"Automatic Sprinkler Extinguishes Fire At FedEx Facility","07/15/2018","Structure","3900 Block Hanson Road, Madison, WI","2018-07-15T03:36:00-05:00"
"Engine 4 Responds To Basement Gas Leak","07/13/2018","Gas Leak","1100 Block Grant Street, Madison, WI","2018-07-13T20:24:00-05:00"
"Rage Against the Slot Machine Sends Paramedics To Ho-Chunk Casino","07/12/2018","EMS","4000 Block Evan Acres Road, Madison, WI","2018-07-12T17:36:00-05:00"
"Branch Smolders After Falling Onto Power Line","07/12/2018","Electrical","2900 Block Curry Parkway, Madison, WI","2018-07-12T11:29:00-05:00"
"Grease Spill Ignites Grill Fire On Barby Lane","07/11/2018","Cooking","4100 Block Barby Lane, Madison, WI","2018-07-11T19:36:00-05:00"
"Smoke Coming From Machine Sends Firefighters To West Side Princeton Club","07/10/2018","Electrical","8000 Block Watts Road, Madison, WI","2018-07-10T19:53:00-05:00"
"Fire In Commercial Sweeper Contained At Camp Randall Stadium","07/09/2018","Appliance","1400 Block Monroe Street, Madison, WI","2018-07-09T14:20:00-05:00"
"Dump Truck Yanks Power Line from Olin Avenue Home","07/09/2018","Electrical","800 Block W. Olin Avenue, Madison, WI","2018-07-09T14:13:00-05:00"
"Engine 10 Sent To Repeated Fires In Northside Pedestrian Tunnel","07/07/2018","Trash/Rubbish","Troy Drive & School Road, Madison, WI","2018-07-07T23:35:00-05:00"
"Residents Were Displaced After An Early Morning Fire On The 500 Block of West Washington Avenue","07/07/2018","Structure","500 Block West Washington, Madison, WI","2018-07-07T04:04:00-05:00"
"Box Of Fireworks Catches Fire In Park Shelter","07/06/2018","Trash/Rubbish","2300 Block Revival Ridge, Madison, WI","2018-07-06T21:32:00-05:00"
"Discarded Fireworks Start Fire, Causing Damage To Nearby Fence","07/04/2018","Trash/Rubbish","400 Block Moorland Road, Madison, WI","2018-07-04T22:53:00-05:00"
"Two Injured In East Washington Avenue Crash","07/04/2018","Vehicle","900 Block E. Washington Ave, Madison, WI","2018-07-04T14:23:00-05:00"
"Fire In Downtown Apartment Extinguished By Automatic Fire Sprinkler","07/03/2018","Structure","100 Block S. Mills Street, Madison, WI","2018-07-03T02:21:00-05:00"
"Woman Locked In Basement Pulls Fire Alarm To Call For Help","07/02/2018","Lock out/Lock in","2300 Block S. Park Street, Madison, WI","2018-07-02T12:03:00-05:00"
"Firefighters Contain Damage Caused By Fire In Bathroom Vent","07/01/2018","Structure","100 Block Craig Avenue, Madison, WI","2018-07-01T06:10:00-05:00"
"Fire Damages Vehicle In Walmart Parking Lot","06/30/2018","Vehicle","700 Block Watts Road, Madison, WI","2018-06-30T13:39:00-05:00"
"Driver Pinned, Injured In Single-Vehicle Crash","06/26/2018","Vehicle","200 Block Cottage Grove Road, Madison, WI","2018-06-26T19:28:00-05:00"
"Apartment Fire Displaces one Resident","06/19/2018","Structure","2000 Block Taft Street, Madison, WI","2018-06-19T19:26:00-05:00"
"Engine 12 Tackles Vehicle Fire On Beltline Highway","06/18/2018","Vehicle","U.S. Highway 12 Westbound & Gammon Road, Madison, WI","2018-06-18T10:27:00-05:00"
"Kayaker OK After Seeking Medical Attention On Lake Wingra","06/18/2018","EMS","Arboretum Drive & Balden Street, Madison, WI","2018-06-18T10:16:00-05:00"
"Firefighters Rescue Woman Stranded In A Tree","06/14/2018","Assist Citizen","400 Block Henry Mall, Madison, WI 53706","2018-06-14T16:04:00-05:00"
"Burned Leaves Send Firefighters To Northside Home","06/14/2018","Outdoor","1200 Block Northport Drive, Madison, WI","2018-06-14T13:15:00-05:00"
"Working Carbon Monoxide Alarm Prompts Household Evacuation Overnight","06/12/2018","Carbon Monoxide","Shorewood Hills, WI 53705","2018-06-12T23:55:00-05:00"
"Crews Respond To Fire In Blooming Grove","06/12/2018","Outdoor","3300 Block Meier Road, Madison, WI","2018-06-12T07:42:00-05:00"
"Diesel Leak Discovered At East Side Construction Site","06/10/2018","Fuel Spill","S. Fair Oaks Avenue & Dixon Street, Madison, WI","2018-06-10T07:15:00-05:00"
"Ten Rescued From Downtown Elevator","06/09/2018","Elevator","100 Block S. Brooks Street, Madison, WI","2018-06-09T00:39:00-05:00"
"Investigators Looking Into Cause Of Fire At The Old Fashioned","06/08/2018","Structure","10 Block N. Pinckney, Madison, WI 53703","2018-06-08T15:49:00-05:00"
"Burned Food Causes Smoke Scare In Downtown Apartment","06/01/2018","Smoke Scare","200 Block Lakelawn Place, Madison, WI","2018-06-01T04:24:00-05:00"
"Two-Vehicle Crash Ties Up East Washington Intersection; One Taken To Hospital","05/29/2018","Vehicle","East Washington Ave. & First Street, Madison, WI","2018-05-29T14:14:00-05:00"
"Kitchen Fire Caused By Unattended Cooking; Nobody Injured","05/28/2018","Cooking","4200 Block Dwight Drive, Madison, WI","2018-05-28T16:15:00-05:00"
"Pickup Truck Totaled After Catching Fire On Beltline","05/28/2018","Vehicle","U.S. Highway 12 (Eastbound), Madison, WI","2018-05-28T15:44:00-05:00"
"Grease Fire Damages West Side Kitchen","05/25/2018","Cooking","5700 Block Balsam Road, Madison, WI","2018-05-25T21:30:00-05:00"
"Ladder 2 Responds To Power Pole Fire","05/24/2018","Outdoor","6000 Block Research Park Blvd, Madison, WI","2018-05-24T15:27:00-05:00"
"Fire Crew Issues Reminder About Safe Grilling","05/22/2018","Cooking","1500 Block Trailsway, Madison, WI","2018-05-22T16:19:00-05:00"
"Station 7 Crews Respond To Rollover Crash","05/19/2018","Vehicle","Schroeder Road & S. Gammon Road, Madison, WI","2018-05-19T13:07:00-05:00"
"Lightning Strikes Two Separate Structures, Minutes Apart","05/14/2018","Lightning Strike","6000 Block Pinelake Drive and 7000 WIldberry Drive, Madison, WI","2018-05-14T00:26:00-05:00"
"Cooking Fire Displaces Family, Sends Two To Hospital","05/11/2018","Cooking","1900 Block Beld Street, Madison, WI 53713","2018-05-11T13:34:00-05:00"
"Woman Injured While Attempting To Fix Dent Using Open Flame","05/10/2018","Vehicle","Greening Lane, Madison, WI 53705","2018-05-10T18:01:00-05:00"
"Two Adults, One Child Transported after Rollover Accident","05/09/2018","Vehicle","1400 Block I-90 WB, Madison, WI","2018-05-09T10:50:00-05:00"
"Two People Trapped on Roof by Apartment Fire","05/08/2018","Structure","200 Block North Street, Madison, WI","2018-05-08T00:07:00-05:00"
"Kayaker, Two Children Rescued From Lake Monona","05/06/2018","Lake Rescue","Lake Monona, Madison, WI","2018-05-06T15:44:00-05:00"
"Engine 9 Responds To Vehicle Fire Outside Eagle Heights","05/05/2018","Vehicle","900 Block Eagle Heights Drive, Madison, WI 53706","2018-05-05T22:39:00-05:00"
"Engine 10 Puts Out Fire In Northport Apartment","05/05/2018","Structure","1900 Block Northport Drive, Madison, WI","2018-05-05T19:19:00-05:00"
"Stranded Boaters Get Helping Hand From MFD Lake Rescue Team","05/05/2018","Lake Rescue","Upper Mud Lake, Madison, WI 53716","2018-05-05T18:54:00-05:00"
"Madison Resident Comes Home to Find Fire in Garage","05/04/2018","Structure","1400 Block Nevada Road, Madison, WI","2018-05-04T18:54:00-05:00"
"One Injured After Vehicle Crashes Into East Side Restaurant","05/04/2018","Vehicle","S. Dickinson Street & Williamson Street, Madison, WI","2018-05-04T15:10:00-05:00"
"Smoking Materials Cause Staircase To Smolder","05/01/2018","Structure","900 Block E. Johnson Street, Madison, WI 53703","2018-05-01T15:37:00-05:00"
"Self-Cleaning Oven Causes Smoke Scare on Nakoosa Trail","05/01/2018","Smoke Scare","4300 Block Nakoosa Trail, Madison, WI","2018-05-01T15:25:00-05:00"
"Mulch Fire Caught Early Outside Sequoya Library","04/30/2018","Outdoor","4300 Block Tokay Blvd, Madison, WI","2018-04-30T09:39:00-05:00"
"Smoke Alarm Wakes Sleeping Occupant, Who Discovers Fire In Kitchen","04/28/2018","Cooking","200 Block N. Ingersoll Street, Madison, WI","2018-04-28T04:43:00-05:00"
"MFD Responds To String Of Outdoor Fires","04/27/2018","Outdoor","Madison, WI","2018-04-27T13:55:00-05:00"
"Fire Discovered, Extinguished At Downtown Restaurant","04/26/2018","Appliance","300 Block State Street, Madison, WI 53703","2018-04-26T23:07:00-05:00"
"Two-Vehicle Crash Results In Fire, Injury","04/25/2018","Vehicle","Commercial Avenue & Felland Road, Madison, WI","2018-04-25T18:05:00-05:00"
"Ladder 2 Responds To Dumpster Fire At Westgate Mall","04/24/2018","Trash/Rubbish","Westgate Mall, Madison, WI","2018-04-24T07:15:00-05:00"
"Flames From Grill On Balcony Send Firefighters To State Street","04/22/2018","Cooking","500 Block State Street, Madison, WI 53703","2018-04-22T11:53:00-05:00"
"Laundry Room Fire Under Investigation","04/20/2018","Structure","4700 Block Jenewein Road, Madison, WI","2018-04-20T21:18:00-05:00"
"Creosote Buildup Causes Small Chimney Fire","04/17/2018","Chimney","2700 Block Union Street, Madison, WI","2018-04-17T22:20:00-05:00"
"Elevator Reportedly Drops Two Floors, Injuring One","04/14/2018","Elevator","400 Block Frances Street, Madison, WI 53703","2018-04-14T17:42:00-05:00"
"Two Injured In Three-Car Crash","04/14/2018","Vehicle","John Nolen Drive & Rimrock Road, Madison, WI 53704","2018-04-14T17:19:00-05:00"
"2 Injured, 5 Displaced After Fire On Schroeder Road","04/14/2018","Structure","6700 Block Schroeder Road, Madison, WI 53711","2018-04-14T00:30:00-05:00"
"Clothes Catch Fire At Campus Dorm, Injuring One","04/08/2018","Cooking","1500 Block Tripp Circle, Madison, WI 53706","2018-04-08T17:25:00-05:00"
"Garage Fire Displaces Family","04/03/2018","Structure","6100 Block Dominion Dr, Madison, WI 53718","2018-04-03T18:54:00-05:00"
"Grilling On Balconies Poses Fire Danger And Risk To Residents","03/30/2018","Outdoor","East Side, Madison, WI","2018-03-30T20:02:00-05:00"
"Wayward Embers Ignite Grass Fire On West Side","03/30/2018","Outdoor","Shadow Ridge Trail, Madison, WI 53562","2018-03-30T10:40:00-05:00"
"Crews Tackle Large Mulch Fire In Town of Blooming Grove","03/28/2018","Outdoor","3500 Block Meier Road, Blooming Grove, WI 53718","2018-03-28T21:09:00-05:00"
"Semis Catch Fire Outside East-Side Bakery","03/26/2018","Vehicle","3400 Block East Washington Ave, Madison, WI 53704","2018-03-26T02:16:00-05:00"
"Fire Damages West-Side Home","03/25/2018","Structure","2300 Block Mica Road, Madison, WI","2018-03-25T16:18:00-05:00"
"Firefighters Douse Large Pile of Hot Wood Chips","03/24/2018","Smoke Scare","Highbury Road & Tally Ho Lane, Shorewood Hills, WI 53705","2018-03-24T19:45:00-05:00"
"Improperly Discarded Smoking Materials Causes $250,000 in Damage","03/21/2018","Structure","4500 Block Hamlet Place, Madison, WI","2018-03-21T09:38:00-05:00"
"Stove-Top Burner Ignites Grease Drippings","03/19/2018","Cooking","6700 Block Schroeder Road, Madison, WI 53719","2018-03-19T16:15:00-05:00"
"Crews Extinguish Several Small Brush and Grass Fires.","03/18/2018","Outdoor","5600 Block Fen Oak Drive, Madison, WI 53718","2018-03-18T11:40:00-05:00"
"Crews Respond to Early Morning Structure Fire","03/18/2018","Structure","4200 Block Doncaster Dr, Madison, WI 53711","2018-03-18T03:04:00-05:00"
"Worker Rescued From Confined Space At MGE Power Plant","03/15/2018","Special Rescue","700 Block E. Main Street, Madison, WI 53703","2018-03-15T10:00:00-05:00"
"Two Suffer Fire-Related Injuries On Commerce Drive","03/14/2018","Vehicle","400 Block Commerce Drive, Madison, WI 53719","2018-03-14T16:47:00-05:00"
"Man Injured After Grabbing Hot Utensil From Stovetop","03/12/2018","Excessive heat/scorch","100 Block S. Franklin Street, Madison, WI 53703","2018-03-12T02:58:00-05:00"
"Ladder 2 Responds to Water Leak At West Towne Mall","03/10/2018","Water Leak","West Towne Mall, Madison, WI","2018-03-10T16:52:00-06:00"
"Ten Rescued From Downtown Elevator","03/08/2018","Elevator","400 Block W. Gorham Street, Madison, WI 53703","2018-03-08T23:03:00-06:00"
"Wash Machine Malfunction Causes Water Leak In East Side Building","03/08/2018","Water Leak","700 Block N. Thompson Drive, Madison, WI","2018-03-08T19:04:00-06:00"
"Smoke Alarm Alerts Occupant To Fire Brewing In Kitchen","03/08/2018","Cooking","1800 Block Cameron Drive, Madison, WI","2018-03-08T01:48:00-06:00"
"Soldering Project Ignites Small Fire In Area Home","03/07/2018","Structure","4000 Block Chippewa Drive, Madison, WI","2018-03-07T15:07:00-06:00"
"All Residents Displaced After Fire In Apartment Building","03/05/2018","Structure","2900 Block Commercial Avenue, Madison, WI 53704","2018-03-05T04:44:00-06:00"
"Worker Rescued From Skid Loader Crashed in Trench","03/03/2018","Special Rescue","700 Block West Dayton Street, Madison, WI","2018-03-03T15:36:00-06:00"
"Fire Damages Eastside Businesses","02/25/2018","Structure","2000 Block Atwood Avenue, Madison, WI","2018-02-25T05:53:00-06:00"
"Engine 4 Responds To Small Electrical Fire","02/21/2018","Electrical","N. Allen Street, Madison, WI","2018-02-21T19:32:00-06:00"
"Natural Gas Smell Reported and Caught Early In East Side Residence","02/21/2018","Gas Leak","1300 Block Rutledge, Madison, WI","2018-02-21T17:59:00-06:00"
"Vehicle Fire Extinguished In Downtown Parking Ramp","02/20/2018","Vehicle","100 Block E. Main Street, Madison, WI 53703","2018-02-20T14:33:00-06:00"
"Man Extinguishes Vehicle Fire With Help From Local Restaurant","02/18/2018","Vehicle","300 Block W. Washington Ave, Madison, WI 53703","2018-02-18T14:39:00-06:00"
"Burnt Food Sends Firefighters To Downtown Apartment","02/18/2018","Cooking","200 Block N. Pinckney St, Madison, WI 53703","2018-02-18T02:36:00-06:00"
"Firefighters Respond To Steam Leak At Campus Bookstore","02/15/2018","Water Leak","700 Block State Street, Madison, WI 53706","2018-02-15T22:11:00-06:00"
"Car Starts On Fire While Out For Test Drive","02/15/2018","Vehicle","2600 Block Fish Hatchery Road, Madison, WI 53713","2018-02-15T13:48:00-06:00"
"Fire Crews Respond to Early Morning Vehicle Fires","02/15/2018","Vehicle","W. Main Street and S. Bedford Street, Madison, WI 53703","2018-02-15T05:10:00-06:00"
"Smoke Fills Downtown Apartment, Hallway; Burning Of Sandalwood To Blame","02/14/2018","Smoke Scare","600 Block W. Doty Street, Madison, WI 53703","2018-02-14T18:34:00-06:00"
"Broken Water Pipe Displaces One","02/11/2018","Water Leak","500 Block Northport Drive, Madison, WI","2018-02-11T03:10:00-06:00"
"Residential Fire on Southside","02/10/2018","Structure","4200 Block Sheffield Ave, Madison, WI 53711","2018-02-10T18:52:00-06:00"
"Engine 1 Called To Rescue Stranded Dog","02/10/2018","Animal rescue","100 Block N. Butler Street, Madison, WI 53703","2018-02-10T17:23:00-06:00"
"Firefighters Respond To Smoke Scare At East Side Apartment","02/09/2018","Smoke Scare","10 Block Dempsey Road, Madison, WI","2018-02-09T14:55:00-06:00"
"Firefighters Provide Scene Safety Following Gas Line Rupture","02/08/2018","Gas Leak","4800 Block Hermsmeier Lane, Madison, WI","2018-02-08T12:36:00-06:00"
"Alarm Investigation Reveals Fire In Downtown Kitchen","02/07/2018","Alarm Investigation","100 Block W. Gilman Street, Madison, WI 53703","2018-02-07T06:42:00-06:00"
"Man Dies Following Serious Crash On Sherman Avenue","02/06/2018","Vehicle","400 Block N. Sherman Ave, Madison, WI","2018-02-06T23:23:00-06:00"
"Leaky Pipe Leads Firefighters To Discover Disabled Fire Alarm System","02/06/2018","Water Leak","3000 Block Cimarron Trail, Madison, WI","2018-02-06T22:13:00-06:00"
"Four Displaced After Unattended Pot of Oil Catches Fire","02/04/2018","Cooking","100 Block Georgiana Circle, Madison, WI","2018-02-04T18:21:00-06:00"
"Burnt Plastic Smell Traced To Furnace Issue","02/03/2018","Smoke Scare","Golden Maple Road, Madison, WI","2018-02-03T00:42:00-06:00"
"Driver Pulls Over, Puts Out Vehicle Fire Using Borrowed Extinguisher","02/01/2018","Vehicle","1800 Block S. Stoughton Road, Madison, WI","2018-02-01T16:18:00-06:00"
"Fire Displaces Two From East Side Condo","02/01/2018","Structure","6300 Block Maywick Drive, Madison, WI 53719","2018-02-01T10:41:00-06:00"
"Occupants Detect Gas Leak In East Side Building","01/31/2018","Gas Leak","800 Block E. Johnson Street, Madison, WI 53703","2018-01-31T16:05:00-06:00"
"Station 2 Crew Revives Patient Suffering From Cardiac Arrest","01/27/2018","EMS","West Side, Madison, WI 53719","2018-01-27T12:02:00-06:00"
"Attic Fire Under Investigation","01/25/2018","Structure","Huron Hill, Madison, WI 53711","2018-01-25T20:53:00-06:00"
"Overheated Motor Kicks Up Smoke Inside Allied Drive Apartment","01/25/2018","Appliance","2300 Block Allied Drive, Madison, WI","2018-01-25T18:24:00-06:00"
"Mac and Cheese Burns While Occupant Sleeps","01/24/2018","Excessive heat/scorch","400 Block W. Main Street, Madison, WI 53703","2018-01-24T03:11:00-06:00"
"Greater Harm Averted Thanks To Neighbor Who Reported Active Smoke Alarm","01/24/2018","Structure","100 Block S. Hamilton, Madison, WI 53703","2018-01-24T01:20:00-06:00"
"Thick Smoke Coming From Oven Uncovers Brats, Plastic Left Behind","01/23/2018","Cooking","2100 Block Lake Point Drive, Madison, WI","2018-01-23T17:40:00-06:00"
"Nobody Injured In Crash That Damaged Two Garage Doors","01/23/2018","Vehicle","2200 Block University Ave, Madison, WI","2018-01-23T14:36:00-06:00"
"HVAC Malfunction Prompts Pre-School Evacuation","01/22/2018","Smoke Scare","6500 Block Schroeder Road, Madison, WI","2018-01-22T10:17:00-06:00"
"Vehicle Strikes Area Home, Causes Significant Damage","01/19/2018","Vehicle","8300 Block Blackwolf Drive, Madison, WI","2018-01-19T10:12:00-06:00"
"Beltline Bus Fire Accidental; Cause Still Unknown","01/18/2018","Vehicle","US Highway 12 Eastbound & Park Street, Madison, WI","2018-01-18T14:53:00-06:00"
"Eastbound Beltline Lanes Closed Near Park Street Exit Due To Bus Fire","01/18/2018","Vehicle","US Highway 12 Eastbound & Park Street, Madison, WI","2018-01-18T14:53:00-06:00"
"Owner Not Present, Driver Missing As Ladder 2 Puts Out Vehicle Fire","01/17/2018","Vehicle","S. Gammon Rd. & Seybold Rd, Madison, WI","2018-01-17T17:29:00-06:00"
"Firefighters Assist Woman Who Fell Shoveling The Sidewalk","01/16/2018","Assist Citizen","4400 Block Elgar Lane, Madison, WI","2018-01-16T13:36:00-06:00"
"Dryer Fire Displaces One","01/12/2018","Appliance","1900 Block Northport Drive, Madison, WI","2018-01-12T14:27:00-06:00"
"Fire Damages East Side Building; Cause Under Investigation","01/10/2018","Structure","4700 Block Helgesen Drive, Madison, WI","2018-01-10T19:43:00-06:00"
"Firefighters Respond To Small Chemical Spill On UW Campus","01/09/2018","Hazmat","1200 Block W. Dayton Street, Madison, WI 53706","2018-01-09T15:24:00-06:00"
"Grease Fire Causes Damage In Northside Kitchen","01/08/2018","Cooking","1400 Block Trailsway, Madison, WI","2018-01-08T16:47:00-06:00"
"Bystanders Alert Driver To Vehicle Fire And Help Put It Out","01/06/2018","Vehicle","Mohawk Drive & Nakoma Road, Madison, WI","2018-01-06T20:49:00-06:00"
"Car Crashes Through Garage Wall, Injuring One","01/06/2018","Vehicle","8500 Block Blackwolf Drive, Madison, WI","2018-01-06T19:34:00-06:00"
"Burned Cheese Believed To Be Cause of Smoke In West Side Apartment","01/05/2018","Cooking","1000 Block McKenna Blvd, Madison, WI 53719","2018-01-05T16:14:00-06:00"
"Cause Of Bread Basket Fire Unknown","01/04/2018","Structure","300 Block Lance Lane, Madison, WI 53703","2018-01-04T08:44:00-06:00"
"Homemade Meat Smoker Catches Fire, Damaging East Side Home","01/03/2018","Structure","5100 Block Starker Ave, Madison, WI 53703","2018-01-03T17:23:00-06:00"
"Crews Respond To Residential Water Leaks, Frozen Pipes","01/02/2018","Water Leak","Madison, WI","2018-01-02T01:53:00-06:00"
"Frozen Pipes Damage State Street Apartments and Business","01/01/2018","Water Leak","300 Block of State Street, Madison, WI 53703","2018-01-01T13:52:00-06:00"
"Neighbors Alert Homeowner To Fire Burning Outside","01/01/2018","Outdoor","2800 Block Commercial Ave, Madison, WI 53703","2018-01-01T05:11:00-06:00"
"Discarded Coals Start Outside Fire Between Two Homes","01/01/2018","Outdoor","University Ave. & Midvale Blvd, Madison, WI 53703","2018-01-01T01:07:00-06:00"
"Firefighters Reunite Locked-Out Grandma With Two-Year-Old Grandchild","12/28/2017","Lock out/Lock in","1800 Block Lynndale Rd, Madison, WI","2017-12-28T18:35:00-06:00"
"Frozen Pipes And Water Leaks Keep Fire Crews Busy","12/28/2017","Water Leak","Madison, WI","2017-12-28T04:07:00-06:00"
"Carbon Monoxide Alarm Sends Firefighters To West Side Condo","12/28/2017","Carbon Monoxide","6700 Block Park Edge Drive, Madison, WI 53711","2017-12-28T00:08:00-06:00"
"Eagle Mistaken For Stranded Dog On Lake Monona","12/27/2017","Animal rescue","10 Block John Nolen Drive, Madison, WI 53703","2017-12-27T07:43:00-06:00"
"Downtown Firefighters Discover Water Leak At State Street Business","12/27/2017","Water Leak","500 Block N. Frances Street, Madison, WI 53703","2017-12-27T03:11:00-06:00"
"Car Left Running Inside Garage Triggers Carbon Monoxide Alarm","12/26/2017","Carbon Monoxide","6800 Block Tottenham Road, Madison, WI","2017-12-26T19:06:00-06:00"
"Burst Pipe Sends Firefighters To Midland Street Residence","12/25/2017","Water Leak","800 Block Midland Street, Madison, WI","2017-12-25T20:44:00-06:00"
"Pressure Cooker Explodes, Causing Damage But No Injuries","12/23/2017","Cooking","1500 Block Troy Drive, Madison, WI","2017-12-23T19:52:00-06:00"
"Resident Escapes House Fire Without Injury","12/23/2017","Structure","1300 Block Dale Avenue, Madison, WI 53705","2017-12-23T14:30:00-06:00"
"Smoke Fills Westside Apartment; Burnt Food To Blame","12/22/2017","Cooking","4500 Block Hammersley Road, Madison, WI","2017-12-22T21:18:00-06:00"
"Furnace Malfunction Sends Firefighters To West Side Home","12/21/2017","Electrical","6000 Block Landfall Drive, Madison, WI 53715","2017-12-21T19:22:00-06:00"
"Crews Respond To Fire At West Side Construction Site","12/18/2017","Outdoor","400 Block Commerce Drive, Madison, WI 53719","2017-12-18T19:33:00-06:00"
"Smoke Fills Downtown Apartment As Occupant Sleeps; No Working Smoke Alarms Found In Unit","12/18/2017","Cooking","100 Block N. Orchard Street, Madison, WI 53703","2017-12-18T18:41:00-06:00"
"Fire 'Erupts,' Injuring Person Repairing Clothes Dryer","12/17/2017","Appliance","400 Block N. Westfield Road, Madison, WI","2017-12-17T23:04:00-06:00"
"Man Rescued From Monona Bay After Falling Through the Ice","12/14/2017","Lake Rescue","Monona Bay, Madison, WI 53715","2017-12-14T12:28:00-06:00"
"Overloaded Wash Machine Sends Firefighters To West Side Apartment Building","12/13/2017","Smoke Scare","2600 Block University Ave, Madison, WI 53703","2017-12-13T18:35:00-06:00"
"Attic Fire Displaces Three On West Side","12/13/2017","Structure","Goldenrod Lane, Madison, WI 53719","2017-12-13T11:33:00-06:00"
"Motor Overheats, Causing Smoke Scare In East Side Garage","12/13/2017","Smoke Scare","800 Block Williamson Street, Madison, WI 53703","2017-12-13T11:22:00-06:00"
"Crews Called To Hit-And-Run At East Side Business; Nobody Injured","12/11/2017","Vehicle","2100 Block Winnebago Street, Madison, WI 53715","2017-12-11T02:23:00-06:00"
"Oven Fire Sends Crews To North Side Home","12/10/2017","Structure","500 Block Dapin Road, Madison, WI 53714","2017-12-10T16:38:00-06:00"
"Firefighters Called To Downtown Apartment Building For Outdoor Fire","12/10/2017","Outdoor","500 Block East Main Street, Madison, WI 53703","2017-12-10T11:35:00-06:00"
"Single-Vehicle Crash Injures One","12/09/2017","Vehicle","Mineral Point Road, Madison, WI","2017-12-09T02:27:00-06:00"
"Fires Near North Star Park Under Investigation","12/08/2017","Outdoor","North Star Park, Madison, WI 53718","2017-12-08T16:00:00-06:00"
"Carbon Monoxide Leak Traced To Hidden Furnace","12/08/2017","Carbon Monoxide","East Bluff, Madison, WI 53703","2017-12-08T02:08:00-06:00"
"One Person Transported From Single-Vehicle Rollover Crash","12/07/2017","Vehicle","Sherman Avenue & Northport Drive, Madison, WI","2017-12-07T19:33:00-06:00"
"Cooking Fire Caught Early On East Side","12/06/2017","Cooking","700 Block Pulley Drive, Madison, WI","2017-12-06T21:30:00-06:00"
"Clothes Catch Fire at West Side Laundromat","12/05/2017","Excessive heat/scorch","2800 Block Todd Drive, Madison, WI","2017-12-05T12:58:00-06:00"
"Driver Extricated From Stolen Vehicle Following Crash","12/05/2017","Vehicle","S. Stoughton Road, Madison, WI 53719","2017-12-05T06:46:00-06:00"
"East Side Restaurant Temporarily Evacuated Due To Carbon Monoxide Leak","12/02/2017","Carbon Monoxide","900 Block Williamson Street, Madison, WI","2017-12-02T16:45:00-06:00"
"Dumpster Fires Threaten Downtown Construction Site","12/02/2017","Trash/Rubbish","200 Block W. Gilman Street, Madison, WI 53703","2017-12-02T11:31:00-06:00"
"Two Injured In Park Street Crash","12/02/2017","Vehicle","S. Park Street & W. Badger Road, Madison, WI","2017-12-02T07:51:00-06:00"
"Ladder 6 Discovers Vehicle Fire Along Beltline Highway","12/02/2017","Vehicle","Westbound U.S. Highway 12 & Fish Hatchery Road, Madison, WI","2017-12-02T00:51:00-06:00"
"Outdoor Fire Traced To Discarded Ashes","11/29/2017","Outdoor","Denton Place, Madison, WI 53711","2017-11-29T10:42:00-06:00"
"One Person Removed From Stalled Elevator","11/27/2017","Elevator","1600 Block Kronshage Drive, Madison, WI 53706","2017-11-27T19:15:00-06:00"
"Occupants Evacuate After Grease Fire Activiates Alarm","11/27/2017","Cooking","4200 Block Monona Drive, Madison, WI 53716","2017-11-27T16:14:00-06:00"
"Carbon Monoxide Alarm Catches Leak Inside Paunack Place Apartment","11/26/2017","Carbon Monoxide","400 Block Paunack Place, Madison, WI 53706","2017-11-26T22:42:00-06:00"
"Closed Lid Keeps Grease Fire Contained","11/24/2017","Cooking","Valor Way, Madison, WI 53703","2017-11-24T20:39:00-06:00"
"Chemical Combination Causes Symptoms, Displaces Occupant From East-Side Home","11/22/2017","Hazmat","Elmside Blvd, Madison, WI 53703","2017-11-22T16:20:00-06:00"
"Basement Fire Displaces Five","11/22/2017","Structure","2000 Block Frisch Road, Madison, WI","2017-11-22T11:13:00-06:00"
"Overnight Vehicle Fire Under Investigation","11/20/2017","Vehicle","1600 Block Arkansas Ave, Madison, WI 53704","2017-11-20T01:05:00-06:00"
"Occupant Uses Bag Of Flour To Extinguish Living Room Fire","11/19/2017","Candle","7000 Block Tree Lane, Madison, WI","2017-11-19T18:01:00-06:00"
"Burned Food Prompts Evacuation From Downtown Building","11/17/2017","Cooking","200 Block S. Randall Ave, Madison, WI 53704","2017-11-17T04:20:00-06:00"
"Downtown Smoke Scare Traced To Blown Power Line","11/16/2017","Smoke Scare","600 Block Langdon Street, Madison, WI 53703","2017-11-16T12:26:00-06:00"
"Head-On Collision Injures Two","11/16/2017","Vehicle","100 Block East Gorham Street, Madison, WI 53703","2017-11-16T04:10:00-06:00"
"Sparks Seen At Witte Hall; Construction Activities The Cause","11/15/2017","Structure","600 Block W. Johnson Street, Madison, WI 53706","2017-11-15T17:38:00-06:00"
"Fire Displaces One From West-Side Duplex","11/14/2017","Structure","7800 Block Courtyard Drive, Madison, WI 53719","2017-11-14T16:05:00-06:00"
"Engine 10 Extinguishes Furnace Fire","11/12/2017","Appliance","1900 Block Windom Way, Madison, WI 53714","2017-11-12T17:10:00-06:00"
"Two Taken to Hospital Following Carbon Monoxide Leak at Downtown Hotel","11/11/2017","Carbon Monoxide","500 Block W. Johnson Street, Madison, WI 53703","2017-11-11T20:53:00-06:00"
"Teacher, Custodian Extinguish Small Fire At Hawthorne Elementary","11/10/2017","Structure","3300 Block Concord Ave, Madison, WI 53703","2017-11-10T09:13:00-06:00"
"Sprinkler Contains Fire In Straubel Street Apartment","11/07/2017","Structure","3500 Block Straubel Street, Madison, WI 53705","2017-11-07T08:21:00-06:00"
"Occupant Falls Asleep With Eggs Boiling On Stovetop","11/07/2017","Cooking","1400 Block Trailsway, Madison, WI 53713","2017-11-07T02:44:00-06:00"
"Steam Mistaken For Smoke On Butler Street","11/06/2017","Smoke Scare","100 Block N. Butler St, Madison, WI 53703","2017-11-06T13:58:00-06:00"
"One Dog Dies, Second Survives In House Fire","11/05/2017","Structure","600 Block Wheeler Road, Madison, WI","2017-11-05T10:53:00-06:00"
"Three Displaced by House Fire","11/04/2017","Structure","4900 Block Hammersley Road, Madison, WI","2017-11-04T04:27:00-05:00"
"One Rescued, Transported Following Rollover Crash","11/04/2017","Vehicle","East Washington Avenue & Mendota Street, Madison, WI 53706","2017-11-04T02:42:00-05:00"
"Five Injured In Single-Vehicle Crash","11/03/2017","Vehicle","700 Block Meadowlark Drive, Madison, WI","2017-11-03T17:37:00-05:00"
"Two Crews Put A Stop To Large Vehicle Fire On I-90","11/03/2017","Vehicle","I-39/90 WB, Madison, WI 53703","2017-11-03T06:12:00-05:00"
"Firefighters Extinguish Unapproved Backyard Fire","11/01/2017","Unauthorized Burning","1300 Block N. Sherman Ave, Madison, WI","2017-11-01T00:36:00-05:00"
"Neighbor Smells Something Burning In Nearby Apartment, One Taken to Detox","10/31/2017","Cooking","200 Block Langdon Street, Madison, WI 53703","2017-10-31T23:35:00-05:00"
"Hazardous Incident Team Handles Spill","10/31/2017","Hazmat","1600 Block University Ave, Madison, WI","2017-10-31T19:37:00-05:00"
"Smoking Materials Found Near the Scenes of Two Overnight Fires","10/30/2017","Structure","East Side, Madison, WI 53703","2017-10-30T22:52:00-05:00"
"Man Returns From Store, Finds His Car On Fire","10/30/2017","Vehicle","2200 Block S. Stoughton Road, Madison, WI","2017-10-30T17:56:00-05:00"
"Snipped Live Wire Sparks Small Fire Inside A Wall","10/30/2017","Electrical","2900 Block Turbot Drive, Madison, WI","2017-10-30T13:17:00-05:00"
"Fire Breaks Out In Laboratory Hood System","10/29/2017","Chimney","3300 Block Kinsman Blvd, Madison, WI","2017-10-29T18:37:00-05:00"
"Coals Tossed Out Too Soon Ignite Small Fire On Gammon Lane","10/29/2017","Trash/Rubbish","1100 Block Gammon Lane, Madison, WI","2017-10-29T13:51:00-05:00"
"Vera Court Dumpster Fire Results In Minor Building Damage","10/28/2017","Trash/Rubbish","800 Block Vera Court, Madison, WI","2017-10-28T10:09:00-05:00"
"Curtains Catch Fire in Apartment","10/21/2017","Structure","1000 Block E. Washington Ave, Madison, WI 53703","2017-10-21T14:28:00-05:00"
"Fire at East Johnson Street Home During Rush Hour","10/20/2017","Structure","500 Block East Johnson Street, Madison, WI 53703","2017-10-20T16:06:00-05:00"
"Natural Gas Odor","10/19/2017","Odor Investigation","5700 Block Odana Road, Madison, WI","2017-10-19T08:08:00-05:00"
"Tree Takes Down Power Line on Regent Street","10/18/2017","Power lines down","1900 Block Regent Street, Madison, WI","2017-10-18T20:38:00-05:00"
"Outdoor Fire Traced To Unattended Ashtray","10/18/2017","Trash/Rubbish","5200 Block Trafalger Pl, Madison, WI","2017-10-18T15:54:00-05:00"
"Discarded Cigarettes Found Near Site of Deck Fire","10/17/2017","Outdoor","9400 Block Old Sauk Road, Madison, WI","2017-10-17T17:02:00-05:00"
"Small Porch Fire Discovered, Extinguished Early","10/17/2017","Outdoor","3100 Block Hermina Street, Madison, WI","2017-10-17T01:47:00-05:00"
"Engine 1 Responds To Grease Fire Downtown","10/15/2017","Cooking","400 Block W. Gorham Street, Madison, WI 53703","2017-10-15T17:11:00-05:00"
"Unattended Candle Causes Smoke Scare","10/13/2017","Candle","5100 Block Brookside Drive, Madison, WI","2017-10-13T03:40:00-05:00"
"Firefighters Respond To Accidental Natural Gas Leak","10/12/2017","Gas Leak","700 Block Ruskin Street, Madison, WI","2017-10-12T18:43:00-05:00"
"Gas-Powered Appliances Kick Up Carbon Monoxide On Park Street","10/12/2017","Carbon Monoxide","60 Block N. Park Street, Madison, WI","2017-10-12T09:12:00-05:00"
"Hazmat Team Called To Recycling Center In Waunakee","10/11/2017","Hazmat","300 Block Raemisch Road, Waunakee, WI","2017-10-11T23:53:00-05:00"
"Carbon Monoxide Detector Triggered By Boiling Cauliflower","10/11/2017","Carbon Monoxide","20 Block Sherman Terrace, Madison, WI","2017-10-11T23:33:00-05:00"
"Crash Injures One, Takes Out Tree and Fire Hydrant","10/11/2017","Vehicle","4000 Block Savannah Road & Millpond Road, Madison, WI","2017-10-11T19:44:00-05:00"
"Smoldering Clothes Send Firefighters To East Side Laundromat","10/09/2017","Appliance","3500 Block East Washington, Madison, WI","2017-10-09T21:00:00-05:00"
"Firefighters Respond To Water Heater Malfunction","10/09/2017","Water Leak","500 Block S. Mills Street, Madison, WI","2017-10-09T20:50:00-05:00"
"Occupant Asleep At Kitchen Table As Food Burns On Stovetop","10/08/2017","Cooking","200 Block S. Broom Street, Madison, WI 53703","2017-10-08T16:45:00-05:00"
"Cyclist Injured On State Street","10/08/2017","Assist Citizen","400 Block State Street, Madison, WI","2017-10-08T14:50:00-05:00"
"MFD Assessing Tornado Damage Along East Washington Avenue","10/07/2017","Power lines down","East Washington Ave, Madison, WI","2017-10-07T17:07:00-05:00"
"Two Injured In Three-Vehicle Beltline Crash","10/06/2017","Vehicle","US Highway 12 Eastbound & John Nolen Drive, Madison, WI","2017-10-06T18:42:00-05:00"
"Charcoal Grill On Balcony Poses Fire Hazard","10/05/2017","Cooking","1500 Block Trailsway, Madison, WI","2017-10-05T20:01:00-05:00"
"Chemical Reaction At West Side Lab Prompts Evacuation, Injures One","10/05/2017","Hazmat","600 Block Science Drive, Madison, WI","2017-10-05T13:09:00-05:00"
"Candle Believed To Be Source Of Sauna Fire","10/03/2017","Structure","200 Block Merry Street, Madison, WI","2017-10-03T09:47:00-05:00"
"Discarded Smoking Materials Ignite Deck Fire","10/03/2017","Structure","4600 Block Treichel Street, Madison, WI","2017-10-03T04:02:00-05:00"
"Kitchen Fire Displaces Occupant On Luann Lane","10/01/2017","Structure","2200 Block Luann Lane, Madison, WI","2017-10-01T13:51:00-05:00"
"Discarded Charcoal Reignites, Damaging Backyard Fence","09/30/2017","Outdoor","1700 Block Van Hise, Madison, WI 53706","2017-09-30T19:04:00-05:00"
"Occupants Put Out Kitchen Fire In Northside Apartment","09/30/2017","Excessive heat/scorch","1500 Block Troy Drive, Madison, WI 53706","2017-09-30T12:09:00-05:00"
"Fire Damages Studio Space On Stewart Street","09/29/2017","Structure","800 Block Stewart Street, Madison, WI 53713","2017-09-29T18:48:00-05:00"
"Unattended Cooking Sends Firefighters to West- and North-side Apartments","09/28/2017","Cooking","500 Block N. Franklin Ave, 2400 block Monterey Drive, Madison, WI 53703","2017-09-28T12:10:00-05:00"
"Firefighters Respond To Shed Fire; Person Turns Himself In","09/28/2017","Structure","4600 Block Cottage Grove Road, Madison, WI","2017-09-28T08:12:00-05:00"
"Firefighters Contain Diesel Leak On Interstate Highway","09/27/2017","Vehicle","I-90 EB, Madison, WI","2017-09-27T09:03:00-05:00"
"Fire Damages Kitchen, Bathroom At Mallards Concession Stand","09/24/2017","Cooking","2900 Block N. Sherman Ave, Madison, WI","2017-09-24T13:27:00-05:00"
"Garbage Fire Extends To Home and Attic; Nobody Injured Or Displaced","09/24/2017","Trash/Rubbish","4400 Block Tokay Blvd, Madison, WI","2017-09-24T12:38:00-05:00"
"Motor Home Catches Fire Along Interstate; No Injuries","09/22/2017","Vehicle","I-90 WB & USH 151 SB, Madison, WI","2017-09-22T16:57:00-05:00"
"Cooking Fire Causes Damage In West Side Apartment","09/22/2017","Cooking","4900 Block Whitcomb Drive, Madison, WI","2017-09-22T14:09:00-05:00"
"One Injured, Building Compromised In East Side Explosion","09/20/2017","Structure","50 Block Corry Street, Madison, WI 53704","2017-09-20T23:14:00-05:00"
"Discarded Cigarette Believed To Be the Cause Of Small Curbside Fire","09/20/2017","Outdoor","Northport Drive & N. Sherman Avenue, Madison, WI","2017-09-20T17:10:00-05:00"
"Fire Displaces Family On S Marquette St","09/19/2017","Structure","100 Block S Marquette St, Madison, WI","2017-09-19T17:51:00-05:00"
"Unauthorized Campfire Extinguished Along Lakeshore Path","09/19/2017","Outdoor","Lakeshore Path, Madison, WI 53706","2017-09-19T17:25:00-05:00"
"Vehicle Fire Damages Two Homes On Hoard Street","09/15/2017","Vehicle","2800 Block Hoard Street, Madison, WI","2017-09-15T15:25:00-05:00"
"Lint Buildup In Dryer Vent Causes Small Fire On East Side","09/13/2017","Appliance","Gem Court, Madison, WI 53705","2017-09-13T18:48:00-05:00"
"Search and Overhaul Underway At Scene of House Explosion","09/13/2017","Structure","7800 Block Stratton Way, Madison, WI","2017-09-13T13:59:00-05:00"
"Stratton Way Explosion Declared Intentional","09/13/2017","Explosion","7800 Block Stratton Way, Madison, WI","2017-09-13T13:59:00-05:00"
"Fire Displaces Occupants From East Side Duplex","09/12/2017","Structure","6600 Block Radford Drive, Madison, WI","2017-09-12T10:42:00-05:00"
"Firefighters Free Dog Trapped In Hay Wagon","09/09/2017","Assist Citizen","6100 Block Milwaukee Street, Madison, WI","2017-09-09T18:59:00-05:00"
"Small Vehicle Fire Caught Early","09/08/2017","Vehicle","4300 Block Mohawk Drive, Madison, WI","2017-09-08T13:18:00-05:00"
"Small Fire Damages Dehumidifier, Other Items, In West Side Basement","09/08/2017","Structure","6200 Block Thornebury Drive, Madison, WI","2017-09-08T07:14:00-05:00"
"Vehicle Damaged By Fire On Packers Avenue","09/07/2017","Vehicle","2000 Block Packers Ave, Madison, WI","2017-09-07T15:02:00-05:00"
"Noxious Odor Traced To Corroded Paint Can at West Side Complex","09/06/2017","Odor Investigation","600 Block N. Pleasant View Road, Madison, WI 53713","2017-09-06T11:29:00-05:00"
"Oil Ignites, Causing Minor Kitchen Damage","09/06/2017","Cooking","3700 Block Portage Road, Madison, WI 53704","2017-09-06T10:08:00-05:00"
"Sherman Avenue Church Fire Under Investigation","09/06/2017","Structure","2100 Block N. Sherman Ave, Madison, WI","2017-09-06T10:05:00-05:00"
"Burned Food Prompts Alarm At UW-Madison Dorm","09/06/2017","Cooking","1900 Block Willow Drive, Madison, WI 53706","2017-09-06T08:57:00-05:00"
"Fire Damages Two Vehicles In Ho-Chunk Parking Lot","09/04/2017","Vehicle","4000 Block Evan Acres Road, Madison, WI 53711","2017-09-04T18:22:00-05:00"
"Active Stove Top Brings Firefighters To East Side Restaurant","09/02/2017","Smoke Scare","1200 Block Williamson Street, Madison, WI 53705","2017-09-02T03:05:00-05:00"
"Smoke Investigation Uncovers Dumpster Fire Behind Hill Farms Property","09/01/2017","Trash/Rubbish","4600 Block University Ave, Madison, WI 53705","2017-09-01T17:17:00-05:00"
"Toasted Taco Shell Causes Minor Smoke Damage In Eagle Heights","09/01/2017","Cooking","200 Block Eagle Heights Drive, Madison, WI","2017-09-01T16:50:00-05:00"
"School Evacuated Because Of Gas Odor","08/31/2017","Fuel Spill","200 Block Schenk Street, Madison, WI","2017-08-31T15:33:00-05:00"
"Two Injured In Whitney Way Crash","08/30/2017","Vehicle","N. Whitney Way & Langlois Street, Madison, WI","2017-08-30T11:12:00-05:00"
"Woman Uses Flour To Put Out Small Cooking Fire","08/28/2017","Cooking","10 Block S. Gammon Road, Madison, WI 53711","2017-08-28T11:50:00-05:00"
"Discarded Cigarettes Start Deck Fire On West Side","08/28/2017","Smoking","Millstone Road, Madison, WI","2017-08-28T10:40:00-05:00"
"Fire Damages SUV in Walmart Parking Lot","08/26/2017","Vehicle","4100 Block Nakoosa Trail, Madison, WI 53706","2017-08-26T16:00:00-05:00"
"Firefighters Find Sleeping Occupant, Burned Food Inside Northside Apartment","08/26/2017","Cooking","Monterey Drive, Madison, WI 53704","2017-08-26T01:29:00-05:00"
"Unattended Cooking Brings Firefighters To Downtown Complex","08/26/2017","Cooking","700 Block Braxton Place, Madison, WI 53703","2017-08-26T00:02:00-05:00"
"Vehicle Crashes Into Local Laundromat","08/25/2017","Vehicle","4600 Block Verona Road, Madison, WI 53703","2017-08-25T20:06:00-05:00"
"Vehicle Fire On West Beltline","08/24/2017","Vehicle","U.S. Highway 12 & Whitney Way, Madison, WI","2017-08-24T18:17:00-05:00"
"Kitchen Fire Breaks Out At West-Side Denny's","08/24/2017","Cooking","400 Block S. Gammon Road, Madison, WI","2017-08-24T18:15:00-05:00"
"One Taken To Hospital After Cooking Fire On West Side","08/23/2017","Cooking","1100 Block High Point Road, Madison, WI 53703","2017-08-23T19:41:00-05:00"
"Engine 13 Extinguishes Grass Fires Along Commercial Avenue","08/22/2017","Outdoor","6700 Block Commercial Ave, Madison, WI 53703","2017-08-22T14:46:00-05:00"
"Sunlight Reflecting Off Mirror Starts Small Fire In Northside Home","08/22/2017","Structure","Texas Trail, Madison, WI 53706","2017-08-22T11:44:00-05:00"
"Gas Leak Causes Evacuation on West Side","08/21/2017","Gas Leak","4300 Block Crawford Dr, Madison, WI 53711","2017-08-21T08:33:00-05:00"
"Vehicle Fire Under Investigation","08/20/2017","Vehicle","700 Block S. Gammon Lane, Madison, WI","2017-08-20T04:29:00-05:00"
"Malfunctioning Exhaust Fan Causes Smoke Scare on East Side","08/19/2017","Smoke Scare","2300 Block E. Johnson Street, Madison, WI","2017-08-19T21:19:00-05:00"
"Three Displaced By Overnight Fire","08/19/2017","Structure","6200 Block Hammersley Rd, Madison, WI","2017-08-19T05:17:00-05:00"
"Oven Left On Inside Vacant Apartment Causes Minor Damage","08/17/2017","Structure","500 Block W. Doty St, Madison, WI 53703","2017-08-17T10:21:00-05:00"
"Electrical Problems Send Firefighters To UW Boathouse","08/16/2017","Electrical","600 Block Babcock Drive, Madison, WI 53706","2017-08-16T23:00:00-05:00"
"Fire Damages Dryer In East Side Residence","08/15/2017","Appliance","100 Block N. First Street, Madison, WI 53703","2017-08-15T20:26:00-05:00"
"Broiler Mistaken For Drawer Spells Trouble for Kitchen Towels","08/14/2017","Cooking","100 Block E. Gilman Street, Madison, WI 53703","2017-08-14T21:17:00-05:00"
"Abandoned Fire Pit Puts Apartment Complex At Risk","08/14/2017","Outdoor","1400 Block Trailsway, Madison, WI","2017-08-14T20:54:00-05:00"
"Self-Cleaning Oven Activates Smoke Detector In East Side Apartment","08/13/2017","Excessive heat/scorch","1900 Block East Washington Ave, Madison, WI","2017-08-13T08:48:00-05:00"
"Campfire Inside Canoe Prompts Response From Lake Rescue Team","08/11/2017","Outdoor","Lake Monona, Madison, WI 53703","2017-08-11T21:18:00-05:00"
"Man Transported To Hospital With Hand Trapped In Mechanical Equipment","08/11/2017","Special Rescue","1300 Block East Washington Ave, Madison, WI 53703","2017-08-11T07:22:00-05:00"
"Occupants Displaced From 30 Unit Apartment Building","08/11/2017","Structure","2200 Block Carling Drive, Madison, WI 53711","2017-08-11T01:09:00-05:00"
"Gas Leak Caused By Landscape Work On West Side","08/10/2017","Gas Leak","8300 Block Old Sauk Road, Madison, WI 53562","2017-08-10T08:17:00-05:00"
"Smoke Detector Alerts Sleeping Woman To Fire In Her Bed","08/09/2017","Candle","600 Block N. Frances Street, Madison, WI 53703","2017-08-09T01:10:00-05:00"
"Station 8 Rescues Woman Pinned Under SUV","08/07/2017","Special Rescue","Bultman Road, Madison, WI 53704","2017-08-07T16:13:00-05:00"
"EMTs Cut Plastic Bottle From Toddler's Finger","08/07/2017","Assist Citizen","Northport Drive, Madison, WI 53704","2017-08-07T08:04:00-05:00"
"Intentional Fire On North Side Under Investigation","08/06/2017","Outdoor","1900 Block Elka Lane, Madison, WI 53704","2017-08-06T18:16:00-05:00"
"Unattended Grill Sparks Patio Fire at Southwest-Side Complex","08/06/2017","Structure","6700 Block Pinelake Drive, Madison, WI 53703","2017-08-06T03:19:00-05:00"
"Grease Fire Damages S. Park Street Kitchen","08/05/2017","Cooking","2300 Block S. Park Street, Madison, WI","2017-08-05T19:30:00-05:00"
"Torch Torches Back Of Van; Driver Uninjured","08/04/2017","Vehicle","1400 Block MacArthur Road, Madison, WI 53713","2017-08-04T15:05:00-05:00"
"Gas Leak Prompts Brief Evacuation on Latham Drive","08/04/2017","Gas Leak","3300 Block Latham Drive, Madison, WI 53704","2017-08-04T07:43:00-05:00"
"Fire Uncovers Flaws In Gas Grill On Southeast Side","08/03/2017","Cooking","6200 Block Eagle Cave Drive, Madison, WI 53558","2017-08-03T17:08:00-05:00"
"Two Freed From Stalled Hospital Elevator","08/03/2017","Elevator","200 Block S. Park Street, Madison, WI 53703","2017-08-03T15:32:00-05:00"
"One Injured In Campus Chemical Spill","07/31/2017","Hazmat","1600 Block Observatory Drive, Madison, WI 53706","2017-07-31T13:36:00-05:00"
"Firefighters Extinguish Fire on Construction Site","07/28/2017","Outdoor","McKee Road, High Point Road, Madison, WI 53711","2017-07-28T08:44:00-05:00"
"Early Morning Apartment Fire Displaces One Person","07/28/2017","Structure","1000 Block West Badger Road, Madison, WI 53713","2017-07-28T05:11:00-05:00"
"Car Fire Near Garage Causes $15,000 in Damage","07/27/2017","Vehicle","2900 Block Maple Run Dr, Madison, WI 53719","2017-07-27T12:18:00-05:00"
"Garage Fire Causes $150,000 in Damage","07/25/2017","Structure","900 Block Inwood Way, Madison, WI 53714","2017-07-25T17:13:00-05:00"
"Burning Blanket Causes Evacuation of 4-Unit Apartment","07/25/2017","Structure","1200 Block E. Dayton St, Madison, WI 53703","2017-07-25T02:55:00-05:00"
"1 Injured in Car vs. Dump Truck Crash","07/24/2017","Vehicle","Madison, WI","2017-07-24T09:40:00-05:00"
"Stove Source of CO Alarm Activiation","07/23/2017","Carbon Monoxide","3100 Block Hermina Street, Madison, WI 53714","2017-07-23T20:50:00-05:00"
"Crews Respond To Vehicle Fire Near John Nolen Drive","07/23/2017","Vehicle","John Nolen Drive, Lakeside Street, Madison, WI 53715","2017-07-23T02:22:00-05:00"
"Madison Fire Department HIT Assists Belleville Fire Department","07/22/2017","Hazmat","400 Block River Street, Belleville, WI 53508","2017-07-22T10:52:00-05:00"
"Firefighters Dispatched to a Swift Water Rescue","07/21/2017","Lake Rescue","5700 Block FORSYTHIA Place, Madison, WI","2017-07-21T18:30:00-05:00"
"Car Hits Building on Karstens Drive","07/21/2017","Vehicle","3700 Block E. Kartens Drive, Madison, WI 53704","2017-07-21T07:30:00-05:00"
"Working Detectors Lead Firefighters Toward Grill Inside Garage","07/20/2017","Carbon Monoxide","1800 Block Kendall Ave, Madison, WI","2017-07-20T00:13:00-05:00"
"Power Line Lands On Metro Bus; Occupants Shelter In Place","07/19/2017","Electrical","600 Block East Gorham Street, Madison, WI 53703","2017-07-19T21:44:00-05:00"
"Engine 7 Helps Locked-Out Mom","07/19/2017","Lock out/Lock in","Glacier Ridge neighborhood, Madison, WI","2017-07-19T08:21:00-05:00"
"Downtown Traffic Diverted Due To Gas Leak On Campus","07/17/2017","Gas Leak","800 Block W. Johnson Street, Madison, WI 53706","2017-07-17T14:54:00-05:00"
"U-Haul Truck Gets Wedged In Garage Door, Tears Off Sprinkler Head","07/15/2017","Water Leak","700 Block Glenway Street, Madison, WI 53711","2017-07-15T10:52:00-05:00"
"Smoking Materials Spark Mattress Fire On East Side","07/14/2017","Smoking","Powers Ave, Madison, WI 53714","2017-07-14T11:29:00-05:00"
"UW Health West Clinic Evacuated After Dozens Fall Ill","07/14/2017","Hazmat","400 Block Junction Road, Madison, WI","2017-07-14T10:30:00-05:00"
"Toilet Paper Left Too Close To Candle Results In Small Fire","07/14/2017","Structure","Junction Court, Madison, WI","2017-07-14T08:51:00-05:00"
"Significant Water Leak Renders Two Stratton Way Condos Uninhabitable","07/13/2017","Water Leak","3000 Block Stratton Way, Madison, WI","2017-07-13T14:08:00-05:00"
"Crash At East Washington & Baldwin Injures Six","07/13/2017","Vehicle","E. Washington Ave. & Baldwin St, Madison, WI 53703","2017-07-13T13:57:00-05:00"
"Smoke In Straubel Court Apartment Traced To Unattended Broiler","07/13/2017","Cooking","10 Block Straubel Court, Madison, WI 53706","2017-07-13T12:57:00-05:00"
"Balloons Caught In Power Lines Cause Brief Road Closure Near Beltline","07/12/2017","Electrical","W. Beltline Frontage Road & Grandview Blvd, Madison, WI 53719","2017-07-12T20:58:00-05:00"
"One Transported To Hospital Following Head-On Collision","07/11/2017","Vehicle","S. Gammon Road & U.S. Highway 12, Madison, WI 53719","2017-07-11T20:00:00-05:00"
"Gas Leak Caught Early Near Bay View Landscaping Project","07/11/2017","Gas Leak","600 Block Bay View, Madison, WI","2017-07-11T08:47:00-05:00"
"Firefighters Help Woman and Child Locked Inside Apartment","07/10/2017","Lock out/Lock in","Raymond Road, Madison, WI 53709","2017-07-10T20:11:00-05:00"
"No Injuries In Car vs. Bicycle Collision","07/10/2017","Vehicle","S. Fair Oaks Ave. & Emmet St, Madison, WI","2017-07-10T14:35:00-05:00"
"Firefighters Contain Fuel Leak On Homberg Lane","07/10/2017","Fuel Spill","1600 Block Homberg Lane, Madison, WI","2017-07-10T14:09:00-05:00"
"One Taken To Hospital After Street Sweeper Tips Over On Stoughton Road","07/10/2017","Vehicle","S. Stoughton Road & Buckeye Road, Madison, WI 53716","2017-07-10T03:51:00-05:00"
"Crews Respond To Flash Floods Throughout West Side","07/10/2017","Assist Citizen","West Side, Madison, WI","2017-07-10T01:35:00-05:00"
"Automatic Sprinkler Snuffs Dumpster Fire At East-Side Complex","07/09/2017","Trash/Rubbish","1600 Block Fordem Ave, Madison, WI 53703","2017-07-09T12:27:00-05:00"
"Garbage Truck Strikes Power Lines, Prompts Evacuations","07/08/2017","Vehicle","200 Block Nautilus Drive, Madison, WI 53705","2017-07-08T16:20:00-05:00"
"Ladder 1 Locates Gas Leak On West Main Street","07/08/2017","Gas Leak","500 Block W. Main Street, Madison, WI 53703","2017-07-08T12:03:00-05:00"
"Fallen Tree Crashes Through Roof of East-Side Home","07/06/2017","Structure","800 Block Woodlawn Drive, Madison, WI","2017-07-06T23:48:00-05:00"
"Storms Cause Electrical Hazards, Power Outages On East Side","07/06/2017","Power lines down","East Side, Madison, WI","2017-07-06T23:35:00-05:00"
"Firefighters Find Carbon Monoxide In West-Side Basement","07/06/2017","Carbon Monoxide","1800 Block Lynndale Road, Madison, WI 53719","2017-07-06T23:01:00-05:00"
"Backyard Burn Brings Firefighters To the Neighborhood","07/06/2017","Outdoor","800 Block Valley Road, Madison, WI 53703","2017-07-06T17:18:00-05:00"
"Cardboard and Other Recyclables Catch Fire In Collection Truck","07/06/2017","Vehicle","2700 Block Marshall Court, Shorewood Hills, WI","2017-07-06T09:10:00-05:00"
"Fireworks Set Off In Apartment Complex Trigger Alarm; No Injuries","07/05/2017","Fireworks","1100 Block Morraine View Drive, Madison, WI 53705","2017-07-05T21:32:00-05:00"
"Vehicle Causes Significant Damage After Crashing Into Garage","07/03/2017","Structure","7800 Block Twinflower Drive, Madison, WI","2017-07-03T21:46:00-05:00"
"With the Help Of Braille, Paramedics Assist East-Side Resident Who Fell","07/02/2017","Assist Citizen","East Side, Madison, WI","2017-07-02T00:48:00-05:00"
"Firefighters Put A Stop To Small Bonfire Off John Nolen Drive","07/01/2017","Trash/Rubbish","John Nolen & Broom Street, Madison, WI 53703","2017-07-01T22:00:00-05:00"
"One Seriously Injured In West-Side Crash","07/01/2017","Vehicle","S. Gammon Road & Gammon Place, Madison, WI 53719","2017-07-01T08:01:00-05:00"
"Smoke Scare Traced Back To Faulty AC Unit","06/30/2017","Appliance","900 Block Watson Ave, Madison, WI","2017-06-30T09:55:00-05:00"
"Alarm Prompts Evacuation Of East-Side Complex","06/28/2017","Alarm Investigation","800 Block East Washington Ave, Madison, WI 53703","2017-06-28T18:37:00-05:00"
"Multiple People Injured In East Washington Crash","06/28/2017","Vehicle","E. Washington & N. First Street, Madison, WI 53703","2017-06-28T15:02:00-05:00"
"Burned Food Sends Firefighters To Petra Place","06/27/2017","Cooking","1100 Block Petra Place, Madison, WI 53713","2017-06-27T00:07:00-05:00"
"Kitchen Fire Causes Minor Damage At Porchlight","06/26/2017","Structure","300 Block N. Brooks Street, Madison, WI 53706","2017-06-26T22:36:00-05:00"
"Large Branch Knocks Out Electrical, Cable Service For East-Side Home","06/24/2017","Power lines down","5100 Block Sherven Drive, Madison, WI 53704","2017-06-24T18:31:00-05:00"
"Engine 5 Responds To Vehicle Fire on Beltline","06/23/2017","Vehicle","Eastbound US Highway 12 & Eastbound I-90, Madison, WI","2017-06-23T22:22:00-05:00"
"Wayward SUV Misses Paramedic, Strikes Ladder Truck","06/22/2017","Vehicle","6700 Block Crescent Road, Madison, WI 53703","2017-06-22T22:07:00-05:00"
"Firefighters Respond To Cooking Fire On Marcy Road","06/22/2017","Cooking","3400 Block Marcy Road, Madison, WI 53713","2017-06-22T19:24:00-05:00"
"Cyclist Injured In Traffic Collision","06/21/2017","Vehicle","Odana Road & Whitney Way, Madison, WI 53705","2017-06-21T09:13:00-05:00"
"Unattended Grill Spurs Small Fire On North Side","06/20/2017","Outdoor","1900 Block Thackeray Road, Madison, WI","2017-06-20T23:54:00-05:00"
"Dumpster Fire Ignites Outside Cheesecake Factory","06/19/2017","Trash/Rubbish","10 Block West Towne Mall, Madison, WI 53713","2017-06-19T19:25:00-05:00"
"Three Displaced After Fire At 4900 Block of Whitcomb Drive","06/19/2017","Structure","4900 Block Whitcomb Drive, Madison, WI","2017-06-19T18:38:00-05:00"
"Autoclave Trips Smoke Alarm In Campus Building","06/19/2017","Smoke Scare","400 Block Henry Mall, Madison, WI 53706","2017-06-19T12:48:00-05:00"
"Flames Seen Atop West Side Business Traced To Electrical Box","06/19/2017","Electrical","2700 Block Todd Drive, Madison, WI 53704","2017-06-19T10:11:00-05:00"
"Fire Damages Unoccupied Downtown Condo; Investigation Underway","06/19/2017","Structure","200 Block S. Bedford Street, Madison, WI 53703","2017-06-19T07:50:00-05:00"
"Lake Rescue Team Treats Woman Injured On Lake Monona","06/18/2017","Lake Rescue","Lake Monona, Monona, WI 53716","2017-06-18T15:22:00-05:00"
"Dumpster Fire Believed To Be the Result Of Discarded Charcoal","06/18/2017","Trash/Rubbish","7700 Block Radcliffe Drive, Madison, WI","2017-06-18T08:07:00-05:00"
"Vehicle Breaks Down, Starts On Fire, Near Stoughton Road","06/17/2017","Vehicle","Highway 30 & N. Stoughton Road, Madison, WI 53715","2017-06-17T19:33:00-05:00"
"Firefighters Get Crash Course In Soda Machine Maintenance At Local McDonald's","06/16/2017","Carbon Monoxide","4500 Block University Ave, Madison, WI 53705","2017-06-16T03:50:00-05:00"
"Flames Seen After Electrical Outlet Shorts Out In Downtown Office","06/15/2017","Electrical","600 Block N. Frances Street, Madison, WI 53703","2017-06-15T22:47:00-05:00"
"One Extricated, Transported Following Single-Vehicle Crash","06/15/2017","Vehicle","Old Sauk Rd. & US Highway 12 (Westbound), Madison, WI 53717","2017-06-15T12:58:00-05:00"
"Ladder 6 Puts A Stop To Small Outside Trash Fire","06/15/2017","Trash/Rubbish","John Nolen Drive & North Shore Drive, Madison, WI 53703","2017-06-15T08:47:00-05:00"
"Large Diesel Leak Contained, Cleaned Up On North Side","06/14/2017","Fuel Spill","600 Block Vera Court, Madison, WI 53706","2017-06-14T09:36:00-05:00"
"Two Cars Damaged In East-Side Crash; No Injuries","06/13/2017","Vehicle","Dunning St. & Atwood Ave, Madison, WI 53703","2017-06-13T15:06:00-05:00"
"No Injuries After U-haul Strikes Canopy Post Outside Regent Street Business","06/12/2017","Vehicle","1200 Block Regent Street, Madison, WI 53706","2017-06-12T14:41:00-05:00"
"Lake Rescue Team Tows Disabled Boat To Shore","06/11/2017","Lake Rescue","Squaw Bay, Lake Monona, Madison, WI 53716","2017-06-11T10:13:00-05:00"
"Downed Power Lines Ignite Backyard Fire","06/10/2017","Outdoor","3900 Block Plymouth Circle, Madison, WI","2017-06-10T16:16:00-05:00"
"Tree Branch Takes Down Power Line Behind Car Dealership","06/10/2017","Electrical","1300 Block Applegate Road, Madison, WI","2017-06-10T15:21:00-05:00"
"Fire Destroys Playground","06/07/2017","Structure","5200 Block Milward Dr, Madison, WI 53711","2017-06-07T15:32:00-05:00"
"Hazardous Incident Team Called To Lux Apartments","06/07/2017","Hazmat","400 Block W. Johnson Street, Madison, WI 53703","2017-06-07T15:00:00-05:00"
"Firefighters Remove Espresso Maker From Unattended Stovetop","06/07/2017","Smoke Scare","500 Block W. Wilson Street, Madison, WI 53703","2017-06-07T08:56:00-05:00"
"Bathtub Overflows, Damaging Smoke Detectors In Apartment Below","06/07/2017","Water Leak","900 Block Acewood Blvd, Madison, WI","2017-06-07T00:00:00-05:00"
"Firefighters Rescue Family Stranded Upstairs After SUV Crashes Into Building","06/04/2017","Vehicle","3100 Block Silverton Trail, Madison, WI 53719","2017-06-04T21:35:00-05:00"
"One Transported To Hospital After Being Pinned Under Vehicle","06/04/2017","Vehicle","Pine Street, Madison, WI 53715","2017-06-04T20:35:00-05:00"
"Ladder 2 Called To Vehicle Fire Outside Walmart","06/04/2017","Vehicle","7200 Block Watts Road, Madison, WI 53706","2017-06-04T17:57:00-05:00"
"No Injuries after Car Hits Ella's Deli","06/03/2017","Vehicle","2900 Block E. Washington Ave, Madison, WI 53704","2017-06-03T12:00:00-05:00"
"Dumpster Fire Prompts Evacuation Of Goodwill Industries Offices","06/02/2017","Structure","1300 Block Mendota St, Madison, WI 53706","2017-06-02T10:22:00-05:00"
"Fire Damages Several Trees On North Side","06/01/2017","Outdoor","600 Block Wheeler Road, Madison, WI 53715","2017-06-01T17:36:00-05:00"
"MFD Heavy Urban Rescue Team Assists In Cambria","05/31/2017","Special Rescue","500 Block Williams Street, Cambria, WI","2017-05-31T23:57:00-05:00"
"Motorcyclist Injured After Veering Off The Road","05/31/2017","Vehicle","Millpond Road & US Highway 12 Eastbound, Madison, WI 53706","2017-05-31T23:04:00-05:00"
"Firefighters Put Out Grass Fire On City's West Side","05/31/2017","Outdoor","700 Block Forward Drive, Madison, WI 53706","2017-05-31T17:34:00-05:00"
"Discarded Cigarette Likely Culprit In Small Fire Involving Railroad Tie","05/31/2017","Outdoor","S. Baldwin St. & E. Wilson St, Madison, WI 53706","2017-05-31T13:55:00-05:00"
"Nobody Home As Firefighters Pull Food From Active Stovetop","05/30/2017","Cooking","300 Block N. Baldwin St, Madison, WI 53703","2017-05-30T16:56:00-05:00"
"Four Transported to UW Hospital","05/29/2017","Vehicle","S. Gammon Road/USH 12 WB S. Gammon Rd Off Ramp, Madison, WI","2017-05-29T11:15:00-05:00"
"One Injured In East Washington Ave. Rollover Crash","05/28/2017","Vehicle","1900 Block East Washington Ave, Madison, WI 53706","2017-05-28T07:32:00-05:00"
"Battery Charger Overheats, Prompting Fire Department Response","05/27/2017","Structure","1400 Block Pflaum Road, Madison, WI 53705","2017-05-27T21:17:00-05:00"
"Charcoal Discarded Too Soon Causes Small Fire; Damage Averted","05/25/2017","Trash/Rubbish","500 Block Blackbird Lane, Madison, WI 53714","2017-05-25T14:08:00-05:00"
"Three Injured In Two-Car Crash","05/24/2017","Vehicle","S. Whitney Way & Raymond Rd, Madison, WI 53705","2017-05-24T13:18:00-05:00"
"Firefighters Assist Two Stranded On Downtown Balcony","05/23/2017","Lock out/Lock in","400 Block W. Gorham Street, Madison, WI 53703","2017-05-23T23:56:00-05:00"
"Car Fire Extinguished On Cottage Grove Road","05/23/2017","Vehicle","Cottage Grove Road & Inwood Way, Madison, WI","2017-05-23T10:54:00-05:00"
"Early Morning Fire Displaces Family","05/23/2017","Structure","1100 Block Valley Stream, Madison, WI","2017-05-23T03:16:00-05:00"
"Teens Flee Illegal Fire On Garver Feed Mill Property","05/19/2017","Outdoor","3200 Block Atwood Ave, Madison, WI 53703","2017-05-19T22:36:00-05:00"
"Discarded Coals Ignite A Fire Outside Northside Home","05/19/2017","Structure","1700 Block Fremont Ave, Madison, WI 53706","2017-05-19T21:45:00-05:00"
"Trash Catches Fire In Garbage Truck During Routine Collection","05/19/2017","Trash/Rubbish","Roth Street & N. Sherman Ave, Madison, WI 53706","2017-05-19T10:20:00-05:00"
"Gas Leak Prompts Small Evacuation On Near West Side","05/19/2017","Gas Leak","S. Breese Terrace, Madison, WI 53713","2017-05-19T09:18:00-05:00"
"Fire Causes Heavy Damage to Vacant Home","05/17/2017","Structure","4600 Block Bunker Hill Lane, Madison, WI","2017-05-17T06:03:00-05:00"
"Cigarette Causes Deck Fire Behind Home","05/17/2017","Structure","2000 Block Browning Rd, Madison, WI 53704","2017-05-17T00:14:00-05:00"
"Gas Line Hit During Excavation","05/16/2017","Gas Leak","1300 Block W. Badger Road, Madison, WI 53713","2017-05-16T11:16:00-05:00"
"No Injuries After Car Hits Building","05/15/2017","Vehicle","Madison, WI","2017-05-15T12:41:00-05:00"
"Smoke Scare At East Side Pub Places Pinball Machine Out Of Service","05/11/2017","Excessive heat/scorch","1400 Block East Washington Ave, Madison, WI 53703","2017-05-11T23:15:00-05:00"
"Overloaded Wash Machine Sends Firefighters To West Side Laundromat","05/11/2017","Excessive heat/scorch","500 Block Grand Canyon Drive, Madison, WI 53705","2017-05-11T16:00:00-05:00"
"Alarms At State Crime Lab Traced Back To Steam","05/11/2017","Smoke Scare","4600 Block University Ave, Madison, WI 53706","2017-05-11T15:46:00-05:00"
"Grease Fire At Park Street Restaurant; No Damage Or Injuries","05/09/2017","Cooking","600 Block S. Park Street, Madison, WI 53706","2017-05-09T12:29:00-05:00"
"Gas Leak In Downtown Apartment Prompts Reminder About Early Reporting","05/09/2017","Gas Leak","300 Block W. Mifflin Street, Madison, WI 53703","2017-05-09T05:48:00-05:00"
"Fire Displaces North Side Family; Nobody Injured","05/07/2017","Structure","800 Block Northland Drive, Madison, WI 53704","2017-05-07T11:12:00-05:00"
"Vehicle Left Running Causes Air Quality Issues In West Side Garage","05/05/2017","Assist Citizen","600 Block N. Segoe Road, Madison, WI 53707","2017-05-05T17:04:00-05:00"
"Rubbish Fire At Dane County Landfill Deemed Accidental","05/04/2017","Trash/Rubbish","7100 Block US Highway 12 & 18, Madison, WI 53718","2017-05-04T05:03:00-05:00"
"'Smoke' Reported At Local Hospital Believed To Be Steam","05/02/2017","Smoke Scare","200 Block S. Park Street, Madison, WI 53703","2017-05-02T22:22:00-05:00"
"Firefighters Discover Burning Plastic Inside East Side Apartment","04/28/2017","Odor Investigation","2500 Block E. Johnson Street, Madison, WI 53706","2017-04-28T14:20:00-05:00"
"Two Injured, One Extricated, In West-Side Crash","04/28/2017","Vehicle","Old Sauk Road & N. Pleasant View Road, Madison, WI 53707","2017-04-28T11:01:00-05:00"
"Cyclist Suffers Minor Injuries In East-Side Collision","04/25/2017","Vehicle","Dolores Drive & Vondron Road, Madison, WI 53704","2017-04-25T15:19:00-05:00"
"Firefighters Called To East Side Auto Shop","04/25/2017","Outdoor","2300 Block S. Stoughton Road, Madison, WI 53713","2017-04-25T12:32:00-05:00"
"Malfunctioning Motor Sends Firefighters To West Side Hotel","04/25/2017","Alarm Investigation","400 Block Commerce Drive, Madison, WI","2017-04-25T02:24:00-05:00"
"Eagle Heights Dumpster Fire May Be Linked To Discarded Smoking Materials","04/24/2017","Trash/Rubbish","900 Block Eagle Heights Drive, Madison, WI 53706","2017-04-24T10:20:00-05:00"
"Pizza Box Left Inside Oven Prompts Fire Department Response","04/23/2017","Cooking","600 Block Mendota Court, Madison, WI 53703","2017-04-23T18:03:00-05:00"
"Two Transported To Hospital Following Crash On Lake Street","04/23/2017","Vehicle","400 Block N. Lake Street, Madison, WI 53703","2017-04-23T10:05:00-05:00"
"Cause Of West-Side Dumpster Fire Unknown","04/23/2017","Trash/Rubbish","6700 Block Schroeder Road, Madison, WI 53705","2017-04-23T07:43:00-05:00"
"Fire at West Side Home Displaces Three People","04/23/2017","Structure","10 Block N. Roby, Madison, WI 53726","2017-04-23T03:03:00-05:00"
"One Injured In Hit-And-Run Crash","04/22/2017","Vehicle","W. Dayton Street / N. Randall Street, Madison, WI 53706","2017-04-22T02:27:00-05:00"
"Smoke-Charged Apartment Traced To Unattended Cooking","04/20/2017","Cooking","7100 Block Tree Lane, Madison, WI 53707","2017-04-20T19:28:00-05:00"
"One Injured After Car Crashes Into East-Side Walgreens","04/20/2017","Vehicle","100 Block Cottage Grove Rd, Madison, WI 53704","2017-04-20T12:17:00-05:00"
"Paint Thinner Spills In Back Of Delivery Truck; Driver Evaluated","04/19/2017","Hazmat","500 Block Tasman Street, Madison, WI 53706","2017-04-19T11:32:00-05:00"
"One Injured In Whitney Way Crash","04/18/2017","Vehicle","200 Block S. Whitney Way, Madison, WI 53705","2017-04-18T20:04:00-05:00"
"Firefighters Ask Man To Move Grill Due To Safety Concerns","04/18/2017","Unauthorized Burning","2400 Block Independence Lane, Madison, WI 53706","2017-04-18T19:35:00-05:00"
"Stream From Dryer Vent Causes Smoke Scare On North Side","04/18/2017","Smoke Scare","1900 Block Pond Street, Madison, WI 53716","2017-04-18T07:47:00-05:00"
"Pizza Burns As Downtown Man Sleeps","04/15/2017","Cooking","100 Block S. Bassett St, Madison, WI 53703","2017-04-15T01:45:00-05:00"
"Nevada Drive Fire Under Investigation","04/13/2017","Structure","1400 Block Nevada Drive, Madison, WI 53704","2017-04-13T22:37:00-05:00"
"One Displaced From Downtown Apartment Following Cooking Fire","04/13/2017","Cooking","700 Block University Ave, Madison, WI 53706","2017-04-13T20:02:00-05:00"
"Smoke Detector Activation Points To Burnt Beans On Unattended Stovetop","04/12/2017","Cooking","2300 Block Allied Drive, Madison, WI 53713","2017-04-12T17:34:00-05:00"
"Nobody Injured In Early-Morning Fire","04/12/2017","Structure","1900 Block East Washington Ave, Madison, WI 53703","2017-04-12T05:12:00-05:00"
"Downtown Restaurant Closed Tuesday Due To Carbon Monoxide Leak","04/11/2017","Carbon Monoxide","400 Block State Street, Madison, WI 53703","2017-04-11T22:26:00-05:00"
"Firefighters respond to a duplex fire on the 3800 block of Sunbrook Road","04/10/2017","Structure","3800 Block Sunbrook Road, Madison, WI 53704","2017-04-10T15:02:00-05:00"
"Grease Fire Causes $5,000 in Damage","04/08/2017","Structure","2900 Block Cimerron Trail, Madison, WI 53719","2017-04-08T18:04:00-05:00"
"Firefighters Discover Smoldering Tree Stump On Henry Street","04/08/2017","Outdoor","400 Block N. Henry Street, Madison, WI 53703","2017-04-08T14:46:00-05:00"
"One Taken To Hospital Following Single-Vehicle Crash","04/08/2017","Vehicle","2100 Block E. Johnson St, Madison, WI 53703","2017-04-08T12:51:00-05:00"
"Fire Consumes SUV On Interstate; No Injuries","04/07/2017","Vehicle","I-90 Westbound, Madison, WI 53717","2017-04-07T11:27:00-05:00"
"Sparking Water Heater Sends Firefighters To Downtown Restaurant","04/06/2017","Electrical","400 Block State Street, Madison, WI 53703","2017-04-06T22:37:00-05:00"
"Malfunctioning Hand Dryer Sends Firefighters To Campus Library","04/03/2017","Excessive heat/scorch","700 Block State Street, Madison, WI 53703","2017-04-03T22:42:00-05:00"
"Gorham Street Vehicle Fire Accidental; Traced To Car Battery","04/03/2017","Vehicle","700 Block E. Gorham St, Madison, WI 53703","2017-04-03T16:26:00-05:00"
"One Injured In Two-Car Crash","04/03/2017","Vehicle","Aberg Ave. & Packer Ave, Madison, WI 53704","2017-04-03T07:24:00-05:00"
"Car A Total Loss Following Fire","03/31/2017","Vehicle","2500 Block Calypso Road, Madison, WI 53706","2017-03-31T22:48:00-05:00"
"One Rescued From Stalled Downtown Elevator","03/31/2017","Elevator","100 Block E. Mifflin Street, Madison, WI 53703","2017-03-31T08:15:00-05:00"
"Oven A Total Loss After Cutting Board Catches Fire In Broiler Drawer","03/29/2017","Cooking","1900 Block Fisher Street, Madison, WI 53703","2017-03-29T14:54:00-05:00"
"Fuel Tank Falls From Truck, Spilling Gasoline On North Side","03/28/2017","Vehicle","Anderson Street & Pankrats Street, Madison, WI 53707","2017-03-28T17:42:00-05:00"
"Firefighters Extinguish Vehicle Fire On Eastbound Beltline","03/28/2017","Vehicle","I90 westbound / Highway 12 eastbound, Madison, WI 53706","2017-03-28T16:49:00-05:00"
"Cooking Fire On Flagstone Drive Displaces Four; Nobody Injured","03/27/2017","Cooking","8300 Block Flagstone Drive, Madison, WI 53717","2017-03-27T17:49:00-05:00"
"Firefighters Rescue Cat From A Tree","03/27/2017","Animal rescue","300 Block Grand Canyon Drive, Madison, WI 53715","2017-03-27T10:52:00-05:00"
"One Transported Following Rollover Crash On Segoe Road","03/25/2017","Vehicle","Mineral Point Road & S. Segoe Road, Madison, WI","2017-03-25T02:40:00-05:00"
"No Injuries In Willy Street Rollover Crash","03/24/2017","Vehicle","1100 Block Williamson Street, Madison, WI 53703","2017-03-24T17:04:00-05:00"
"Firefighters Use Ladder To Free Man Trapped Under Vehicle","03/24/2017","Assist Citizen","2800 Block Dryden Drive, Madison, WI 53715","2017-03-24T12:40:00-05:00"
"At Least Two Homes Affected By Lightning Strikes Thursday Evening","03/23/2017","Lightning Strike","Madison, WI 53705","2017-03-23T19:20:00-05:00"
"Dumpster Carrying Construction Waste Catches Fire; Cause Unknown","03/21/2017","Trash/Rubbish","Post Road / Syene Road, Madison, WI 53706","2017-03-21T15:03:00-05:00"
"Edgewood Smoke Scare Traced To Art Room Kiln","03/21/2017","Smoke Scare","900 Block Woodrow Street, Madison, WI 53714","2017-03-21T04:57:00-05:00"
"Winter Glove Holds Up Downtown Elevator","03/20/2017","Elevator","200 Block Martin Luther King, Jr. Blvd, Madison, WI 53703","2017-03-20T09:55:00-05:00"
"Overloaded Dryer Catches Fire In West Side Home","03/19/2017","Appliance","70 Block Oak Creek Trail, Madison, WI 53707","2017-03-19T17:36:00-05:00"
"Firefighters Respond To Balcony Fire; No Injuries","03/18/2017","Structure","N. Third Street, Madison, WI 53703","2017-03-18T03:39:00-05:00"
"Unauthorized Burns Prompt Springtime Reminder About Outdoor Fires","03/17/2017","Unauthorized Burning","Madison, WI","2017-03-17T22:43:00-05:00"
"Vehicle Tips Over Following East Washington Collision; No Injuries","03/16/2017","Vehicle","E. Washington & N. First Street, Madison, WI 53703","2017-03-16T17:18:00-05:00"
"Faulty Hoverboard Sparks A Call To The Fire Department","03/14/2017","Assist Citizen","1900 Block Northport Drive, Madison, WI 53703","2017-03-14T20:29:00-05:00"
"Firefighters Free Woman Trapped Under File Cabinet","03/14/2017","Special Rescue","300 Block E. Wilson Street, Madison, WI 53703","2017-03-14T15:17:00-05:00"
"Vehicle Fire in Parking Ramp Causes $7,000 in damage. No Injuries.","03/14/2017","Vehicle","200 Block S. Park Street, Madison, WI 53715","2017-03-14T14:05:00-05:00"
"Fire Damages Backyard Sauna On East Dayton Street","03/13/2017","Structure","1900 Block E. Dayton Street, Madison, WI 53703","2017-03-13T00:05:00-05:00"
"Vehicle Damages Craft Store On Monona Drive","03/12/2017","Vehicle","4100 Block Monona Drive, Madison, WI 53713","2017-03-12T14:57:00-05:00"
"Vehicle Strikes Utility Box, Causing Power Outage On East Side","03/11/2017","Electrical","5100 Block Brandenburg Way, Madison, WI 53716","2017-03-11T01:11:00-06:00"
"Firefighters Called To Illegal Bonfire Behind Garver Feed Mill","03/10/2017","Unauthorized Burning","3200 Block Atwood Ave, Madison, WI 53713","2017-03-10T23:08:00-06:00"
"Water Leak Prompts Alarm, Evacuation At Downtown Apartment Complex","03/10/2017","Water Leak","400 Block W. Gorham Street, Madison, WI 53715","2017-03-10T19:14:00-06:00"
"Allied Drive Fire A Result Of Carelessly-Discarded Smoking Materials","03/10/2017","Smoking","2100 Block Allied Drive, Madison, WI 53713","2017-03-10T16:01:00-06:00"
"Neighbor Reports Fire On Downtown Balcony","03/08/2017","Structure","300 Block S. Hamilton Street, Madison, WI 53703","2017-03-08T17:33:00-06:00"
"Three 'Booms' Heard Before Firefighters Are Called To Grass Fire","03/08/2017","Power lines down","2400 Block Esch Lane, Madison, WI 53711","2017-03-08T14:12:00-06:00"
"Large Tree Takes Down Power Lines On East Side","03/08/2017","Power lines down","900 Block Pflaum Road, Madison, WI 53704","2017-03-08T10:52:00-06:00"
"Clothes Catch Fire At Local Laundromat; Static Electricity May Be To Blame","03/07/2017","Appliance","2800 Block Todd Drive, Madison, WI 53713","2017-03-07T21:48:00-06:00"
"Family Comes Home To Dryer Fire On Buckeye Road","03/07/2017","Appliance","4500 Block Buckeye Road, Madison, WI 53705","2017-03-07T15:02:00-06:00"
"Firefighters Called To Downtown Apartment For Small Grease Fire","03/06/2017","Cooking","100 Block W. Johnson Street, Madison, WI 53703","2017-03-06T14:06:00-06:00"
"Single-Vehicle Crash Causes Multiple Hazards, No Injuries","03/05/2017","Vehicle","Watts Rd. & Struck St, Madison, WI 53713","2017-03-05T10:33:00-06:00"
"Madison Firefighters Extinguish Smoky Furniture Store Fire","03/04/2017","Electrical","2200 Block East Springs Dr, Madison, WI","2017-03-04T08:57:00-06:00"
"Engine 5 Contains Fuel Leak On Interstate Highway","03/02/2017","Vehicle","I-90 Westbound & Cottage Grove Rd, Madison, WI 53718","2017-03-02T12:42:00-06:00"
"Firefighters Remove Door To Access Burning Food","02/27/2017","Smoke Scare","300 Block W. Wilson Street, Madison, WI 53703","2017-02-27T20:22:00-06:00"
"Smoking Pan Found On Unattended Stove; No Damage Or Injuries","02/27/2017","Smoke Scare","Moorland Road, Madison, WI 53706","2017-02-27T19:04:00-06:00"
"Ten People Displaced After Fire at East Side Apartment Building","02/26/2017","Structure","700 Block N Thompson Drive, Madison, WI","2017-02-26T22:54:00-06:00"
"Car Troubles A Precursor To Vehicle Fire On East Dayton Street","02/25/2017","Vehicle","E. Dayton Street & N. Third Street, Madison, WI 53703","2017-02-25T13:25:00-06:00"
"Lint Catches Fire In North Lawn Ave. Basement","02/25/2017","Appliance","500 Block North Lawn Ave, Madison, WI 53703","2017-02-25T11:24:00-06:00"
"Large Tree Limb Damages Roof Of West Side Home","02/24/2017","Assist Citizen","5200 Block Whitcomb Drive, Madison, WI 53717","2017-02-24T22:05:00-06:00"
"Employees Extinguish Small Kitchen Fire At Downtown Restaurant","02/24/2017","Cooking","300 Block State Street, Madison, WI 53703","2017-02-24T18:55:00-06:00"
"Overheated Air Purifier Sends Firefighters To West Side Apartment","02/24/2017","Electrical","Coronado Court, Madison, WI 53717","2017-02-24T16:16:00-06:00"
"Car Damaged By Fire Due To Carelessly Discarded Smoking Materials","02/23/2017","Vehicle","4000 Block Evan Acres Road, Madison, WI 53705","2017-02-23T12:03:00-06:00"
"Vehicle Fire Outside City-County Building","02/21/2017","Vehicle","200 Block Martin Luther King, Jr. Blvd, Madison, WI 53703","2017-02-21T21:52:00-06:00"
"Firefighters Investigate HVAC Issue At Olin Ave. Business","02/21/2017","Smoke Scare","200 Block E. Olin Ave, Madison, WI 53703","2017-02-21T10:42:00-06:00"
"East Side Apartment Building Temporarily Evacuated Due To Carbon Monoxide","02/21/2017","Carbon Monoxide","2400 Block E. Washington Ave, Madison, WI 53705","2017-02-21T07:57:00-06:00"
"Firefighters Called To Smoke-Filled Downtown Apartment","02/21/2017","Cooking","400 Block W. Wilson Street, Madison, WI 53703","2017-02-21T00:30:00-06:00"
"Fire Consumes Vehicle On Walnut Street","02/20/2017","Vehicle","500 Block Walnut Street, Madison, WI 53703","2017-02-20T13:28:00-06:00"
"Structure Fire On Sherman Terrace","02/19/2017","Structure","Sherman Terrace, Madison, WI 53703","2017-02-19T04:44:00-06:00"
"Burned Steaks To Blame For Downtown Smoke Scare","02/18/2017","Cooking","300 Block W. Johnson St, Madison, WI","2017-02-18T21:50:00-06:00"
"Unattended Pan Of Oil Leads To Small Kitchen Fire","02/16/2017","Cooking","Flower Lane, Madison, WI 53717","2017-02-16T23:03:00-06:00"
"Crews Extricate Driver From Tipped Vehicle","02/14/2017","Vehicle","Winnebago St. & First St, Madison, WI 53703","2017-02-14T21:03:00-06:00"
"Small Fire In Back Of Pickup Truck Traced To Discarded Cigarette","02/14/2017","Assist Citizen","E. Dayton Street & N. Few Street, Madison, WI 53703","2017-02-14T13:49:00-06:00"
"Two-Vehicle Crash On Femrite Drive Injures One","02/11/2017","Vehicle","Femrite Drive & I90 Eastbound, Madison, WI","2017-02-11T13:25:00-06:00"
"Vehicle Leaking Gasoline Towed From Downtown Ramp","02/10/2017","Vehicle","300 Block W. Mifflin Street, Madison, WI 53703","2017-02-10T20:06:00-06:00"
"Toxic Chemical Combo Sends One To Hospital","02/10/2017","Hazmat","300 Block Samuel Drive, Madison, WI 53703","2017-02-10T15:37:00-06:00"
"One Transported To Hospital With Thumb Lodged In Bathroom Sink","02/10/2017","Assist Citizen","Sherman Terrace, Madison, WI 53703","2017-02-10T11:21:00-06:00"
"Overloaded Wash Machine Causes Water Spill","02/09/2017","Water Leak","Gerry Court, Madison, WI 53703","2017-02-09T17:59:00-06:00"
"Man Suffers Serious Injuries After Falling Into 6-Foot Pit","02/08/2017","EMS","2700 Block S. Stoughton Road, Madison, WI","2017-02-08T23:13:00-06:00"
"Man Uninjured After Car Ahead Of Him Knocks Down Light Pole","02/08/2017","Vehicle","Verona Road / Atticus Way, Madison, WI","2017-02-08T10:25:00-06:00"
"Black Lab Accidentally Turns On Stovetop Burners; Dog And Owner OK","02/07/2017","Structure","Buckeye Road area, Madison, WI 53705","2017-02-07T15:14:00-06:00"
"Garbage Truck Contents Catch On Fire","02/07/2017","Trash/Rubbish","N. Biltmore Ln. / Eastpark Blvd, Madison, WI","2017-02-07T12:11:00-06:00"
"Plow Truck Sustains Damage Following Small Fire","02/07/2017","Vehicle","1000 Block Short Street, Madison, WI","2017-02-07T07:46:00-06:00"
"Food Left On Active Stovetop Prompts Fire Department Response","02/07/2017","Cooking","200 Block S. Park Street, Madison, WI","2017-02-07T01:50:00-06:00"
"Crash Involving Electrical Box Live, Driver Ordered to Stay in Vehicle","02/03/2017","Vehicle","N. Butler St and E. Washington Ave, Madison, WI","2017-02-03T18:09:00-06:00"
"Smoke Odor At Grocery Store Traced To Light Ballast","02/02/2017","Electrical","600 Block S. Whitney Way, Madison, WI","2017-02-02T17:22:00-06:00"
"Suspicious Vehicle Fire Under Investigation","02/02/2017","Vehicle","2400 Block S. Park Street, Madison, WI","2017-02-02T13:52:00-06:00"
"Gallons of Gasoline Spill At Northside Gas Station","02/01/2017","Fuel Spill","2300 Block Commercial Ave, Madison, WI 53703","2017-02-01T10:38:00-06:00"
"Paramedics Help Man Get Back On His Feet, Then Shovel His Driveway","01/31/2017","Assist Citizen","Cameo Lane, Madison, WI 53703","2017-01-31T11:44:00-06:00"
"Three Transported From Stoughton Road Crash","01/30/2017","Vehicle","S. Stoughton Road / Pflaum Road, Madison, WI","2017-01-30T11:42:00-06:00"
"Box Of Tissues Catches Fire In East Side Apartment","01/30/2017","Trash/Rubbish","30 Block N. Sherman Terrace, Madison, WI","2017-01-30T01:59:00-06:00"
"Discarded Ashes Ignite Trash Can Fire","01/30/2017","Trash/Rubbish","4100 Block Hillcrest Drive, Madison, WI 53703","2017-01-30T00:08:00-06:00"
"Burning Smell Traced To Dishwasher In West Side Home","01/29/2017","Smoke Scare","1100 Block Winding Way, Madison, WI","2017-01-29T17:27:00-06:00"
"Oil Heating on Stove Causes $500.00 Damage","01/25/2017","Alarm Investigation","5000 Block Siggelkow Rd, Madison, WI 53718","2017-01-25T16:27:00-06:00"
"Arcing Wires Cause Small Fire In Tree","01/25/2017","Power lines down","700 Block Parman Street, Madison, WI 53711","2017-01-25T07:08:00-06:00"
"Alert Neighbor Calls Fire Department For Smoke Coming From Apartment","01/24/2017","Cooking","1200 Block E. Gorham Street, Madison, WI 53715","2017-01-24T07:08:00-06:00"
"Car Left Running Inside Garage Triggers Carbon Monoxide Alarm","01/24/2017","Carbon Monoxide","1200 Block S. Whitney Way, Madison, WI 53703","2017-01-24T02:48:00-06:00"
"Chimney Bomb Puts A Stop To Fire At West Side Home","01/23/2017","Chimney","6400 Block Antietam Ln, Madison, WI","2017-01-23T19:30:00-06:00"
"Faulty Electrical Panel Sends Firefighters To Downtown Hotel","01/23/2017","Smoke Scare","600 Block Langdon Street, Madison, WI","2017-01-23T19:07:00-06:00"
"Fire At Downtown Construction Site Shuts Down 400 Block of W. Mifflin","01/23/2017","Structure","400 Block W. Mifflin St, Madison, WI 53703","2017-01-23T15:29:00-06:00"
"Broken Valve Causes Gas Leak at East Side Home","01/21/2017","Gas Leak","2300 Block Myrtle Street, Madison, WI 53703","2017-01-21T11:17:00-06:00"
"Four Displaced By Garage Fire On Tottenham Road","01/20/2017","Structure","6800 Block Tottenham Rd, Madison, WI","2017-01-20T21:51:00-06:00"
"Burning Wood Smell Traced To Flourescent Light Bulb","01/20/2017","Odor Investigation","1800 Block Windam Way, Madison, WI","2017-01-20T19:10:00-06:00"
"MFD On Scene Of Rollover Crash - John Nolen Drive","01/20/2017","Vehicle","John Nolen Drive / East Olin Ave, Madison, WI","2017-01-20T10:58:00-06:00"
"Occupants Safely Escape Gas Leak In West Side Home","01/19/2017","Gas Leak","2500 Block Chamberlain Ave, Madison, WI","2017-01-19T12:54:00-06:00"
"Vehicle Fire On East Broadway","01/18/2017","Vehicle","East Broadway, Madison, WI","2017-01-18T07:45:00-06:00"
