Incident,Date,Incident Type,Address,Updated
"Overloaded Dryer Catches Fire In University Ave. Laundry Room","09/01/2016","Appliance","6200 Block University Ave, Madison, WI",""
"Teen Injured Following Vehicle Rollover In School Parking Lot","09/01/2016","Vehicle","700 Block Pflaum Road, Madison, WI",""
"Vehicle Fire Extends To Neighboring Car On Calypso Road","09/01/2016","Vehicle","2400 Block Calypso Road, Madison, WI",""
"Semi Rollover Causes Traffic Backup on Stoughton Rd. at Highway 30","08/31/2016","Vehicle","N. Stoughton Road / Highway 30, Madison, WI","Updated: 09/01/2016"
"Toxic Chemical Combo Brings Firefighters and Paramedics To DOC","08/30/2016","Hazmat","3000 Block E. Washington Ave, Madison, WI",""
"Construction Site Temporarily Evacuated; Mysterious Gas Odor To Blame","08/30/2016","Gas Leak","10 Block W. Main Street, Madison, WI",""
"Firefighters Assist Man With Trailer Troubles On Midvale","08/29/2016","Assist Citizen","Madison, WI",""
"Broken Belt Creates Smoky Situation In Bridge Road Basement","08/29/2016","Excessive heat/scorch","6400 Block Bridge Rd, Madison, WI",""
"Nobody Injured Or Displaced By Small Fire On East Side","08/28/2016","Structure","Prairie Rose Road, Madison, WI",""
"Suspicious Fire Damages Southside Home, Displaces 4 Residents","08/27/2016","Structure","200 Block Koster Street, Madison, WI 53713","Updated: 09/22/2016"
"MFD Assists Sun Prairie Fire In Town Of Burke","08/26/2016","Structure","6000 Block Portage Road, Madison, WI",""
"1 Transported With Injuries Following House Fire On Fifth Street","08/26/2016","Structure","100 Block N. Fifth Street, Madison, WI",""
"Firefighters Help Woman Off the Floor, Walk Her To Dinner","08/24/2016","Assist Citizen","600 Block N. Segoe Road, Madison, WI",""
"Weather-Damaged Mustang Takes A Turn For the Worse","08/24/2016","Vehicle","1900 Block Freeport Road, Madison, WI",""
"No Damage Following Small Cooking Fire On Prairie Road","08/23/2016","Cooking","3300 Block Prairie Rd, Madison, WI",""
"Hand Freed From Home Garbage Disposal","08/22/2016","Assist Citizen","Madison, WI",""
"Basement Fire Displaces Family Of Six","08/22/2016","Structure","2400 Block Lafollette Ave, Madison, WI","Updated: 08/29/2016"
"Smoking Vehicle Summons Firefighters To Downtown Lot","08/22/2016","Vehicle","100 Block N. Blair Street, Madison, WI",""
"One Transported Following Rollover Crash On East Washington Ave.","08/21/2016","Vehicle","East Washington Avenue & Sparkle Court, Madison, WI",""
"Vehicle Crashes Into Building, Three People Injured","08/21/2016","Vehicle","1100 Block Williamson Street, Madison, WI",""
"Firefighters Rescue Dog Trapped Under Lakeshore Dock","08/20/2016","Special Rescue","Lakeshore Path, Madison, WI 53705",""
"Vehicle Totaled By Fire In Engine Compartment","08/20/2016","Vehicle","700 Block S. Gammon Road, Madison, WI",""
"Lightning Strikes Home On East Side","08/19/2016","Structure","3800 Block Sunbrook Rd, Madison, WI",""
"Two Displaced, One Injured by Early Morning Fire","08/19/2016","Structure","800 Block Sky Ridge Drive, Madison, WI",""
"Firefighters Rescue Man Trapped Inside Bobcat","08/18/2016","Vehicle","Buena Vista St, Madison, WI",""
"Smoke Odor Alarms Child Care Staff On Park Street","08/17/2016","Smoke Scare","2200 Block S. Park Street, Madison, WI",""
"Oil Cleanup Materials Smolder Outside West Side Restaurant","08/16/2016","Outdoor","700 Block S. Gammon Road, Madison, WI",""
"Tree Falls On Capitol Lawn, Injuring Two","08/16/2016","Assist Citizen","Carroll Street & W. Washington Avenue, Madison, WI",""
"Home Evacuated Following Small Gas Leak","08/16/2016","Gas Leak","Eliot Ln, Madison, WI",""
"Madison Fire Department Assists With Small Spill On UW Campus","08/16/2016","Hazmat","700 Block Highland Ave, Madison, WI",""
"Multiple Occupants Displaced By Fire At River's Edge Apartments","08/14/2016","Structure","1700 Block Fordem Ave, Madison, WI","Updated: 09/08/2016"
"Firefighters Cut Balcony Cookout Short","08/14/2016","Smoke Scare","1700 Block Fordem Ave, Madison, WI",""
"Lake Rescue Team, Engine 3 Aid Distressed Swimmer","08/13/2016","Lake Rescue","1000 Block Wisconsin Ave, Madison, WI",""
"Large Grease Spill On West Side Summons Fire Crews, HazMat Team","08/13/2016","Hazmat","700 Block S. Gammon Road, Madison, WI",""
"Gasoline Spill Discovered In North Side Parking Lot","08/13/2016","Gas Leak","500 Block East Bluff, Madison, WI",""
"Creative Mosquito Abatement Method Quickly Swatted Away","08/11/2016","Outdoor","500 Block Oak Street, Madison, WI",""
"Engine Co. 12 Helps Locked-In AAA Employee","08/11/2016","Assist Citizen","8400 Block Excelsior Drive, Madison, WI",""
"One Injured In Cooking Fire On North Side","08/11/2016","Cooking","Northridge Terrace, Madison, WI",""
"Emergency Crews Called Twice To Full Compass Systems","08/11/2016","Hazmat","9700 Block Silicon Prairie Parkway, Madison, WI",""
"Marsh Road Business Briefly Evacuated For Small Fire","08/11/2016","Structure","3700 Block Marsh Rd, Madison, WI",""
"Jet Ski Capsizes On Lake Mendota; No Injuries","08/10/2016","Lake Rescue","Lake Mendota, Madison, WI",""
"Small Fire Ignites Inside Broiler Used As Storage Space","08/09/2016","Cooking","W. Main Street, Madison, WI",""
"Smoke Scare Sends Firefighters To Downtown Restaurant","08/08/2016","Smoke Scare","100 Block East Main Street, Madison, WI",""
"Wedding Celebration Evacuated, 26 People Transported Due To Carbon Monoxide Incident","08/06/2016","Carbon Monoxide","5000 Block Blazing Star Drive, Madison, WI",""
"Traffic Crash At Northport and Troy, Two Injured","08/03/2016","Vehicle","Northport Drive / Troy Drive, Madison, WI",""
"Body Recovered From Lake Monona","08/02/2016","Lake Rescue","Lake Monona, Madison, WI",""
"Automatic Sprinkler Quickly Extinguishes Apartment Fire On Jenewein Road","07/31/2016","Candle","4700 Block Jenewein Rd, Madison, WI",""
"SUV Crashes Into Sommers Avenue Home, Nobody Injured","07/30/2016","Vehicle","2200 Block Sommers Ave, Madison, WI",""
"Firefighter respond to Hazardous Material Incident at Pellitteri Waste Systems","07/28/2016","Hazmat","4000 Block Kipp Street, Madison, WI",""
"Crews Extinguish Generator Fire","07/27/2016","Structure","100 Block W. Washington Ave, Madison, WI",""
"Metal Shavings Catch Fire at Alter Metal Recycling","07/24/2016","Outdoor","4400 Block Sycamore Ave, Madison, WI 53714",""
"Lighting Strikes Home on Tree Ridge Trail.","07/23/2016","Structure","5300 Block Tree Ridge Trail, Madison, WI 53718",""
"Lightning Strikes Condo, Causing Fire On Midvale Blvd.","07/21/2016","Structure","500 Block Midvale Blvd, Madison, WI",""
"Stay Off City Roads, Madison Fire Warns","07/21/2016","Outdoor","Madison, WI",""
"MFD Responds To Over 120 Storm-Related Calls, Issues Reminder About Confronting Floods","07/21/2016","Outdoor","Madison, WI",""
"Multiple Injuries Following Five-Car Crash On Highway 51","07/19/2016","Vehicle","U.S. Highway 51 / Terminal, Madison, WI",""
"Two Cars Damaged In Vehicle Fire On Aberg Avenue","07/19/2016","Vehicle","1800 Block Aberg Ave, Madison, WI",""
"Cause Of Outdoor Fire Unknown","07/19/2016","Outdoor","1000 Block Woodward Drive, Madison, WI",""
"Grill Fire Remains Isolated, Causes Minimal Damage","07/17/2016","Cooking","1600 Block Deerwood Drive, Madison, WI",""
"Kitchen Fire On Blue Heron Drive","07/17/2016","Cooking","9500 Block Blue Heron Drive, Madison, WI",""
"Driver Uninjured After Car Strikes Building At Ho Chunk Casino","07/17/2016","Vehicle","4000 Block Evan Acres Road, Madison, WI",""
"One Rescued From Downtown Elevator","07/16/2016","Elevator","10 Block W. Main Street, Madison, WI",""
"Small Fire Ignites Inside Greasy Stove","07/15/2016","Cooking","400 Block E. Village Green Ln, Madison, WI",""
"Family Finds Fire, Not Pokmon, At Demetral Field","07/14/2016","Outdoor","Demetral Field, Madison, WI",""
"No Injuries In Vehicle Fire On West Side; One Cited For Crossing Fire Hose","07/13/2016","Vehicle","S. Yellowstone Drive / Mineral Point Road, Madison, WI",""
"Three Displaced By Cooking Fire On Raymond Road","07/12/2016","Cooking","6500 Block Raymond Rd, Madison, WI",""
"East Side Fire Displaces Four People","07/11/2016","Structure","1800 Block Packers Avenue, Madison, WI",""
"Fire Results In $70,000 In Damage At Packers Ave. Home; Nobody Injured","07/11/2016","Structure","1800 Block Packers Ave, Madison, WI",""
"Small Fire Extinguished With Help Of City Streets Crew","07/11/2016","Outdoor","5800 Block Femrite Dr, Madison, WI",""
"Driver Injured After Car Crashes Into Park Street Walgreens","07/10/2016","Vehicle","2100 Block S. Park Street, Madison, WI",""
"Firefighters Help Stranded Kids Kayaking On Lake Wingra","07/08/2016","Lake Rescue","Lake Wingra, Madison, WI",""
"Cyclist Injured In North Side Crash","07/07/2016","Vehicle","Packers Ave. / Aberg Ave, Madison, WI",""
"Laptop Explodes, Causes Small Fire On West Side; Nobody Injured","07/06/2016","Structure","6400 Block Enterprise Ln, Madison, WI",""
"Storm-Related Emergencies Included Electrical Hazards, Home Health Scares","07/06/2016","Outdoor","City of Madison, Madison, WI",""
"Downed Power Lines Cause Fire On Tompkins","07/06/2016","Outdoor","1000 Block Tompkins Dr, Madison, WI",""
"East Side Man Told Not To Use Gasoline As Weed Killer","07/04/2016","Outdoor","N. Seventh Street, Madison, WI",""
"Fuel Overflow At Gas Station Places Pumps Out Of Service","07/04/2016","Outdoor","6200 Block Schroeder Rd, Madison, WI",""
"Outdoor Fire On Williamson Street Violated Several City Rules","07/02/2016","Unauthorized Burning","1400 Block Williamson St, Madison, WI",""
"Large Tree Limb Damages Two Vehicles; Nobody Injured","06/30/2016","Electrical","600 Block Sheldon Street, Madison, WI",""
"Back Yard Fire On Morrison Did Not Meet Safety Standards","06/29/2016","Unauthorized Burning","1300 Block Morrison Street, Madison, WI",""
"Mattress Goes Up In Flames Outside North Side Home","06/28/2016","Trash/Rubbish","Shelley Lane, Madison, WI",""
"Firefighters Called Twice To Catalpa Road For Similar Incidents","06/28/2016","Fireworks","Catalpa Road, Madison, WI",""
"Unattended Burner Leads To Stovetop Fire On Southwest Side","06/27/2016","Structure","6700 Block Pima Drive, Madison, WI",""
"Infant Unharmed Following Accidental Lock-In","06/26/2016","Vehicle","2100 Block Frisch Rd, Madison, WI",""
"Hotel Guests Relocated Due To Flooding Following Storms","06/26/2016","Water Leak","5200 Block East Terrace Blvd, Madison, WI",""
"Six People Rescued From Capsized Boat","06/26/2016","Lake Rescue","4600 Block of Tonyawatha Trail, Madison, WI",""
"Cause Of Vilas Avenue Garage Fire Under Investigation","06/25/2016","Structure","1700 Block Vilas Ave, Madison, WI",""
"Apartment Fire Displaces Three People","06/24/2016","Cooking","2800 Block of Cimarron Trail, Madison, WI",""
"Westbound I-90 Shut Down For Multi-Vehicle Crash","06/24/2016","Vehicle","I90 Westbound, Madison, WI 53718","Updated: 06/24/2016"
"Fire Damages Pressure Washer At East Side Business","06/22/2016","Electrical","3700 Block Lexington Ave, Madison, WI",""
"Firefighters Respond To Crash At Mineral Point and Gammon Pl.","06/22/2016","Vehicle","Mineral Point Rd. / Gammon Pl, Madison, WI",""
"Solar Oven Damaged By Fire On East Side","06/21/2016","Outdoor","5100 Block Starker Ave, Madison, WI",""
"Disconnected Power Line Caused Brief Outage, Road Closure Tuesday","06/21/2016","Electrical","1900 Block E. Mifflin St, Madison, WI",""
"Nobody Injured Or Displaced By Appliance Fire On Wheeler Road","06/17/2016","Appliance","1300 Block Wheeler Road, Madison, WI",""
"Itsy Bitsy Spider Blamed For Alarm Activation","06/17/2016","Alarm Investigation","1600 Block Capital Ave, Madison, WI",""
"Oven Removed From West-Side PDQ Following Small Fire","06/16/2016","Cooking","7700 Block Mineral Point Rd, Madison, WI",""
"Carbon Monoxide Disaster Averted","06/14/2016","Carbon Monoxide","2500 Block of Calypso Rd, Madison, WI",""
"Grill On Downtown Balcony Deemed Unsafe","06/14/2016","Unauthorized Burning","10 Block Bassett Street, Madison, WI",""
"Schoep's Ice Cream Evacuated Due To Ammonia Leak; No Injuries","06/14/2016","Gas Leak","500 Block Division Street, Madison, WI",""
"Firefighters Investigate Outdoor Burning Complaint; Find No Problems","06/12/2016","Outdoor","2100 Block Fremont Ave, Madison, WI",""
"Rollover Crash and Vehicle Fire On Beltline Highway","06/11/2016","Vehicle","Eastbound U.S. Highway 12 / Westbound I-90, Madison, WI",""
"Engine 13 Called For Electrical Arcing Inside Oven","06/10/2016","Electrical","500 Block Aztalan, Madison, WI",""
"Warner Park Porta-Potty Fire Under Investigation","06/09/2016","Outdoor","Warner Park, 2900 block Sherman Ave., Madison, WI",""
"Propane Tank Bursts Into Flames On West Side; Nobody Injured","06/09/2016","Outdoor","5600 Block Research Park Blvd, Madison, WI",""
"Northside Balcony Fire Under Investigation","06/08/2016","Structure","2400 Block Fremont Ave, Madison, WI",""
"Unattended Cooking Fire Displaces One","06/07/2016","Cooking","3100 Block Muir Field Rd, Madison, WI",""
"Driver Transported Following Rollover Crash on Northport","06/07/2016","Vehicle","1400 Block Northport Drive, Madison, WI",""
"Cause Of Southside Shed Fire Undetermined","06/07/2016","Structure","3100 Block Churchill Drive, Madison, WI",""
"Dog Leash Gets Tangled In A Scooter On East Washington","06/06/2016","Assist Citizen","1900 Block E. Washington Ave, Madison, WI",""
"Lake Rescue Team Assists With Kayak Fire On Lake Monona","06/06/2016","Lake Rescue","Lake Monona, Madison, WI",""
"Large Dumpster Fire Dowtown May Have Been Intentional","06/06/2016","Trash/Rubbish","600 Block N. Frances St, Madison, WI",""
"Tupperware Lids Smolder Inside Oven Drawer","06/05/2016","Cooking","2900 Block Curry Parkway, Madison, WI",""
"Driver Pinned Following Early-Morning Beltline Crash","06/04/2016","Vehicle","Westbound Beltline / Park Street, Madison, WI",""
"Firefighters Knock Down Car Fire On Franklin Ave.","06/03/2016","Vehicle","500 Block N. Franklin Ave, Madison, WI",""
"Firefighters Called To Schroeder Road; Intoxicated Cooking To Blame","06/02/2016","Cooking","6800 Block Schroeder Rd, Madison, WI",""
"Discarded Cigarette Starts Small Balcony Fire","06/02/2016","Smoking","Ponwood Circle, Madison, WI",""
"Hotdogs Burn After Cook Falls Asleep","06/02/2016","Cooking","2800 Block Hauk Street, Madison, WI",""
"Firefighters Still on Scene at Recycling Plant Fire","06/01/2016","Structure","1800 Block S. Park Street, Madison, WI","Updated: 06/02/2016"
""
"Automatic Sprinkler System Extinguishes Cooking Fire","06/01/2016","Cooking","5400 Block Congress Ave, Madison, WI",""
"Firefighters, Paramedics Respond To Vehicle Crash Outside Fire Station","05/31/2016","Vehicle","1500 Block Troy Drive, Madison, WI",""
"Firefighters Assist Child Locked In Bathroom","05/31/2016","Assist Citizen","1900 Block S. Thompson Drive, Madison, WI",""
"Baking Stone Left Inside Oven Causes Small Fire","05/29/2016","Appliance","Lilac Lane, Madison, WI",""
"Ladder 1 Responds To Car Fire At Downtown Parking Lot","05/28/2016","Vehicle","300 Block W. Gorham Street, Madison, WI",""
"Windy Day Rustles Up Several Calls To Madison Fire","05/28/2016","Electrical","City of Madison, Madison, WI",""
"Engine 10 Called to Trailsway For Grill Violation","05/28/2016","Outdoor","1500 Block Trailsway, Madison, WI",""
"Running Car Produces Carbon Monoxide In Area Condo","05/28/2016","Carbon Monoxide","Nessling Street, Madison, WI",""
"Rental Car Totalled Following Fire On the Interstate","05/27/2016","Vehicle","I90 Westbound, Madison, WI",""
"Tree Limb Takes Down Power Cable On East Side","05/27/2016","Electrical","Wirth Court, Madison, WI",""
"Electrical Outlet Overheats at Grocery Store","05/27/2016","Excessive heat/scorch","3600 Block University Ave, Madison, WI",""
"Careless Cooking Causes Apartment Fire","05/26/2016","Structure","700 Block Vera Court, Madison, WI",""
"Residential Gas Leak on Mammoth Trail","05/26/2016","Gas Leak","3500 Block Mammoth Trail, Madison, WI",""
"Vehicle Fire on Linden Drive","05/26/2016","Vehicle","1600 Block Linden Dr, Madison, WI",""
"Downed Lines Cause Temporary Power Outage on East Side","05/26/2016","Electrical","2800 Block Commerical Avenue, Madison, WI",""
"Three Transported After Multi-Vehicle Crash on S. Stoughton Rd.","05/25/2016","Vehicle","S. Stoughton Rd. at Buckeye Rd, Madison, WI",""
"Fire Damages Storage Shed","05/25/2016","Structure","3900 Block Milwaukee St, Madison, WI",""
"Two Children Locked in Vehicle","05/25/2016","Assist Citizen","5800 Block Raymond Rd, Madison, WI",""
"Mishandling of Smoking Materials Starts Condo Fire; Smoke Detectors and Pull Stations Were Inoperable","05/25/2016","Structure","1000 Block Rockefeller Lane, Madison, WI",""
"Misuse of Grill Prompts Fire Scare","05/25/2016","Outdoor","7200 Block E Valley Ridge Dr, Madison, WI",""
"CO Alarms Avert Disaster for Family","05/24/2016","Carbon Monoxide","900 Block E. Dayton St, Madison, WI",""
"Child Accidentally Locked in Vehicle","05/24/2016","Assist Citizen","1500 Block Troy Dr, Madison, WI",""
"Small Fire in Median on Packers Avenue","05/23/2016","Outdoor","Packers Ave @ N. Sixth St, Madison, WI",""
"Landscaping Wood Chips Found Smoldering on Park Street","05/23/2016","Outdoor","2200 Block S. Park St, Madison, WI",""
"Downed Wires on Fairview Road","05/23/2016","Electrical","Fairvew Rd/Eagle Crest Dr, Madison, WI",""
"Carbon Monoxide Alarm on Craig Avenue","05/23/2016","Carbon Monoxide","100 Block Craig Ave, Madison, WI",""
"Sunny Day Causes Concern on Monroe Street","05/22/2016","Structure","1800 Block Monroe Street, Madison, WI",""
"Fire Alarm Triggered by High-Heat Cooking","05/22/2016","Smoke Scare","Sauk Ridge Trail, Madison, WI",""
"LP Grill Starts Fire on Deck of Home","05/22/2016","Structure","4400 Block Rigney Lane, Madison, WI",""
"Smoldering Cigarettes Cause Smoke Scare on Junction Road","05/22/2016","Smoke Scare","200 Block Junction Rd, Madison, WI",""
"Spilled Duck Fat Makes for a Slippery Situation on the Square","05/22/2016","Hazmat","100 Block N. Carroll St, Madison, WI",""
"Heat Tape Causes Smoke Scare at Goodman Center","05/22/2016","Smoke Scare","100 Block Waubesa St, Madison, WI",""
"Outdoor Fire at Packers Ave. & International Ln.","05/22/2016","Outdoor","Packers at International, Madison, WI",""
"Burnt Brats Result in Fire Call","05/22/2016","Odor Investigation","4800 Block Camden Rd, Madison, WI",""
"Carbon Monoxide Alarm Causes Building Evacuation Downtown","05/21/2016","Carbon Monoxide","200 Block N. Pinckney St, Madison, WI",""
"Residential Gas Leak on Near East Side","05/19/2016","Gas Leak","Fairmont Ave, Madison, WI",""
"Child Locked in Vehicle","05/19/2016","Assist Citizen","Chapel Hill Rd, Madison, WI",""
"MFD Responds to Gas Line Break","05/19/2016","Gas Leak","Hickory St. @ Spruce St, Madison, WI",""
"Engine 3 Responds To Small Vehicle Fire On East Washington Ave.","05/17/2016","Vehicle","1100 Block E. Washington Ave, Madison, WI",""
"Resident Asked To Put Out Backyard Construction Waste Fire","05/17/2016","Unauthorized Burning","Waubesa Street, Madison, WI",""
"Vehicle Crashes Into East Side Home, Injuring One","05/16/2016","Vehicle","2600 Block Milwaukee Street, Madison, WI",""
"Grease Buildup Causes Small Fire Inside Eagle Heights Oven","05/16/2016","Cooking","800 Block Eagle Heights, Madison, WI",""
"Walk-Up At Station 3 Reports Gasoline Leak On Ingersoll","05/15/2016","Vehicle","300 Block of S. Ingersoll St, Madison, WI",""
"Carbon Monoxide Alarm Alerts Couple To Major Problem Brewing Inside Garage","05/15/2016","Carbon Monoxide","Carrington Dr, Madison, WI",""
"Alarm, Sprinkler Activation At Chuck E. Cheese Reveals Overheated Air Compressor","05/14/2016","Excessive heat/scorch","400 Block Grand Canyon Dr, Madison, WI",""
"Automatic Sprinkler System Extinguishes Fire at YWCA","05/14/2016","Structure","100 Block E. Mifflin Street, Madison, WI 53703",""
"Outdoor Fire Extinguished Due To Ordinance Violations","05/12/2016","Outdoor","3800 Block Tulane Ave, Madison, WI",""
"Firefighters Respond To Cooking Fire On MacArthur Road","05/12/2016","Cooking","1200 Block MacArthur Rd, Madison, WI",""
"Construction Equipment Strikes Gas Line, Causing Leak On Development Site","05/12/2016","Gas Leak","Arbor Mist Pass/Sugar Maple Lane, Madison, WI",""
"Gas Leak Inside Oven Causes Small Fire On North Side","05/11/2016","Gas Leak","300 Block Bunting Ln, Madison, WI",""
"Storage Shed Destroyed By Fire On East Side","05/11/2016","Structure","Gerald Street, Madison, WI",""
"Arcing Reported In Northport PDQ Electrical Outlet","05/10/2016","Electrical","1400 Block Northport Dr, Madison, WI",""
"Engine 8 Called To Dumpster Fire On Webb Ave.","05/08/2016","Trash/Rubbish","Webb Ave. / Rosemary Ave, Madison, WI",""
"Smoke, But No Fire, Seen Coming From Microwave","05/08/2016","Appliance","6200 Block Hammersley Rd, Madison, WI",""
"Backyard Campfire Extinguished On Hillcrest Dr.","05/07/2016","Unauthorized Burning","4300 Block Hillcrest Dr, Madison, WI",""
"Sprinkler Extinguishes Fire at the Radisson Inn","05/06/2016","Structure","Grand Canyon Dr, Madison, WI","Updated: 05/09/2016"
"Caller Sees "Something Alive" In Lake Monona; Lake Rescue Team Called","05/05/2016","Lake Rescue","200 Block E. Lakeside St, Madison, WI",""
"Gas Leak Discovered At East Washington Construction Site","05/04/2016","Gas Leak","East Washington Avenue & Few Street, Madison, WI",""
"Neighbor Feared Picnic Table Was On Fire At Nearby Park","05/03/2016","Cooking","Sauk Creek Park, Madison, WI",""
"One Rescued From Stalled Elevator On Midvale","05/03/2016","Elevator","Midvale Blvd, Madison, WI",""
"Engine 8 Responds To Vehicle Fire On Eastbound Interstate","05/03/2016","Vehicle","I90 Eastbound, Mile marker 139.0, Madison, WI",""
"Unhappy Hotel Guest Pulls Fire Alarm","05/03/2016","Alarm Investigation","Junction Ct, Madison, WI",""
"Charcoal Grill the Source of Carbon Monoxide At West Side Townhouse","05/02/2016","Carbon Monoxide","3200 Block Keswick Dr, Madison, WI",""
"Alarms Sound After Plate Melts Inside Downtown Oven","05/02/2016","Smoke Scare","100 Block S. Hamilton Street, Madison, WI",""
"Nobody Injured After Boat Capsizes On Lake Mendota","05/01/2016","Lake Rescue","Lake Mendota, Madison, WI",""
"Firefighters Give Locked-In Toddler The Keys To Freedom","05/01/2016","Assist Citizen","2400 Block Regent Street, Madison, WI",""
"MFD Hazmat Team Called to Janesville For Chemical Spill","04/29/2016","Hazmat","US Highway 14, Janesville, WI",""
"Alarm Sends Engine 1 To UW-Madison Dormitory","04/29/2016","Alarm Investigation","900 Block University Ave, Madison, WI",""
"Steam From East Side Bakery Mistaken For Smoke","04/28/2016","Smoke Scare","3400 Block of East Washington Ave, Madison, WI",""
"Burned Food Sends Firefighters To Apartment On Hancock St.","04/26/2016","Cooking","100 Block S. Hancock St, Madison, WI",""
"East Side Fire Caused By Discarded Cigarette","04/26/2016","Structure","3300 Block Ridgeway Ave, Madison, WI",""
"VA Hospital Dumpster Fire Extinguished With the Help Of 'Bucket Brigade'","04/26/2016","Trash/Rubbish","2500 Block Overlook Terrace, Madison, WI",""
"West Side Garage Fire Under Investigation","04/26/2016","Structure","6600 Block Berkshire Rd, Madison, WI","Updated: 05/03/2016"
"Ice Cream Maker Serves Up Smoke At East Side McDonald's","04/26/2016","Cooking","4000 Block McDonald's, Madison, WI",""
"Firefighters Respond To Garbage Truck On Fire On Lake Street","04/25/2016","Trash/Rubbish","400 Block N. Lake Street, Madison, WI","Updated: 04/26/2016"
"Cause Of West Side Outdoor Fire Unknown","04/24/2016","Outdoor","6800 Block Colony Dr, Madison, WI",""
"Firefighters Knock Down Dumpster Fire On Stoughton Rd.","04/24/2016","Trash/Rubbish","2500 Block S. Stoughton Rd, Madison, WI",""
"Beachfront Campfire At Giddins Park","04/23/2016","Unauthorized Burning","400 Block Castle Place, Madison, WI",""
"Resident Douses Smoldering Straw Bale At East Side Community Garden","04/23/2016","Outdoor","Hargove St. / Walter St, Madison, WI",""
"Overloaded Laundry Machines Warrant A Visit From Firefighters","04/22/2016","Odor Investigation","10 Block N. Franklin St, Madison, WI",""
"Passerby Concerned About Smoke; Firefighers Find Controlled Burn","04/21/2016","Smoke Scare","Rustling Birch Rd, Madison, WI",""
"No Injuries After Man Loses Control Of Jet Ski in Lake Monona","04/20/2016","Lake Rescue","Lake Monona, Madison, WI",""
"Downtown Resident Grabs Dinner, Comes Home To Firefighters In Backyard","04/18/2016","Unauthorized Burning","600 Block E. Gorham St, Madison, WI",""
"McDonald's On Park Temporarily Shut Down After Smoke Scare","04/18/2016","Appliance","2400 Block S. Park St, Madison, WI",""
"Grass Fire Reported Near Westbound Interstate","04/18/2016","Outdoor","I90 Westbound, Madison, WI",""
"Four People Displaced Following a Kitchen Fire in Apartment","04/17/2016","Cooking","700 Block of Brandie Road, Madison, WI",""
"Discarded Ashes Start Grass Fire On North Side Lawn","04/17/2016","Outdoor","1600 Block Arkansas Ave, Madison, WI",""
"Odana Road Business Heavily Damaged by Smoke","04/15/2016","Structure","6100 Block Odana Road, Madison, WI","Updated: 04/17/2016"
"Two Removed, Transported After SUV Rolls Over On Broom Street","04/14/2016","Vehicle","Broom St. / Johnson St, Madison, WI 53703",""
"Source of Burning Smell On Blount Street Remains A Mystery","04/14/2016","Smoke Scare","400 Block S. Blount St, Madison, WI",""
"Engine 8 Called To Multiple Illegal Fires In East Side Park","04/14/2016","Outdoor","4300 Block Nakoosa Trl, Madison, WI",""
"Lake Rescue Team Assists Stranded Boaters on Lake Mendota","04/14/2016","Lake Rescue","2000 Block University Bay Dr, Madison, WI",""
"INFORMATION: Controlled Burning Of Natural Lawns and Prairies","04/13/2016","Outdoor","Madison, WI",""
"Firefighters Called Twice to Downtown Construction Site","04/12/2016","Structure","500 Block University Ave, Madison, WI",""
